,id,iata,icao,description
2817,13062,LRE,YLRE,"Longreach, Australia: Longreach Airport"
2818,13063,LRF,KLRF,"Jacksonville, AR: Little Rock AFB"
2819,13064,LRG,OPLL,"Loring, AK: Loring Airport"
2821,13065,LRH,LFBH,"La Rochelle, France: La Rochelle/Laleu"
2823,13067,LRL,DXNG,"Niamtougou, Togo: Niamtougou International"
2824,13068,LRM,MDLR,"La Romana, Dominican Republic: Casa de Campo International"
2827,13071,LRT,LFRH,"Lorient, France: Lorient Lann Bihoue"
2828,13072,LRU,KLRU,"Las Cruces, NM: Las Cruces International"
2829,13073,LSA,AYKA,"Losuia, Papua New Guinea: Kiriwina"
2830,13074,LSC,SCSE,"La Serena, Chile: La Florida"
2832,13076,LSE,KLSE,"La Crosse, WI: La Crosse Regional"
2833,13077,LSF,KLSF,"Columbus, GA: Lawson AAF"
2834,13078,LSI,EGPB,"Lerwick, United Kingdom: Sumburgh"
2835,13079,LSL,MRLC,"Los Chiles, Costa Rica: Los Chiles Airport"
2836,13080,LSN,KLSN,"Los Banos, CA: Los Banos Municipal"
2837,13081,LSP,SVJC,"Las Piedras, Venezuela: Josefa Camejo International"
2838,13082,LSQ,SCGE,"Los Angeles, Chile: Maria Dolores"
2840,13084,LSS,TFFS,"Les Saintes, Guadeloupe: Terre de Haut"
2841,13085,LST,YMLT,"Launceston, Australia: Launceston Airport"
2842,13086,LSU,WBGU,"Long Sukang, Malaysia: Long Sukang Airport"
2843,13087,LSV,KLSV,"Las Vegas, NV: Nellis AFB"
2844,13088,LSX,WITL,"Lhok Sukon, Indonesia: Lhok Sukon Airport"
2845,13089,LTA,FATZ,"Tzaneen, South Africa: Letaba"
2847,13091,LTD,HLTD,"Ghadames, Libya: Ghadames Airport"
2848,13092,LTI,ZMAT,"Altai, Mongolia: Altai Airport"
2849,13093,LTM,SYLT,"Lethem, Guyana: Lethem Airport"
2850,13094,LTN,EGGW,"London, United Kingdom: London Luton"
2851,13095,LTO,MMLT,"Loreto, Mexico: Loreto International"
2852,13096,LTQ,LFAT,"Le Touquet, France: Le Touquet Cote D Opale"
2853,13097,LTS,KLTS,"Altus, OK: Altus AFB"
2854,13098,LTV,YLOV,"Lotusvale, Australia: Lotusvale Airport"
2855,13099,LUA,VNLK,"Lukla, Nepal: Lukla Airport"
2856,13100,LUD,FYLZ,"Luderitz, Namibia: Luderitz Airport"
2857,13101,LUE,LZLU,"Lucenec, Slovakia: Lucenec Airport"
2858,13102,LUF,KLUF,"Phoenix, AZ: Luke AFB"
2859,13103,LUG,LSZA,"Lugano, Switzerland: Lugano Airport"
2861,13105,LUK,KLUK,"Cincinnati, OH: Cincinnati Municipal Lunken Field"
2862,13106,LUL,KLUL,"Laurel, MS: Hesler-Noble Field"
2863,13108,LUN,FLKK,"Lusaka, Zambia: Kenneth Kaunda International"
2864,13109,LUP,PHLU,"Kalaupapa, HI: Kalaupapa Airport"
2865,13110,LUQ,SAOU,"San Luis, Argentina: San Luis Airport"
2866,13111,LUR,PALU,"Cape Lisburne, AK: Cape Lisburne LRRS"
2867,13112,LUT,YLRS,"Laura Station, Australia: Laura Station Airport"
2868,13113,LUX,ELLX,"Luxembourg, Luxembourg: Luxembourg Airport"
2869,13114,LVB,SIXD,"Livramento, Brazil: Livramento Airport"
2870,13115,LVD,K2AK,"Lime Village, AK: Lime Village Airport"
2871,13117,LVK,KLVK,"Livermore, CA: Livermore Municipal"
2872,13118,LVM,KLVM,"Livingston, MT: Livingston Airport"
2873,13119,LVO,YLTN,"Laverton, Australia: Laverton Airport"
2874,13120,LVS,KLVS,"Las Vegas, NM: Las Vegas Municipal"
2875,13121,LWB,KLWB,"Lewisburg, WV: Greenbrier Valley"
2877,13124,LWL,KLWL,"Wells, NV: Wells Municipal/Harriet Field"
2878,13125,LWM,KLWM,"Lawrence, MA: Lawrence Municipal"
2879,13126,LWO,UKLL,"Lviv, Ukraine: Lviv International"
2880,13127,LWS,KLWS,"Lewiston, ID: Lewiston Nez Perce County"
2881,13128,LWT,KLWT,"Lewistown, MT: Lewistown Municipal"
2882,13129,LWV,KLWV,"Lawrenceville, IL: Lawrenceville-Vincennes International"
2883,13130,LWY,WBGW,"Lawas, Malaysia: Lawas Airport"
2884,13131,LXA,ZULS,"Lhasa, China: Gonggar"
2885,13132,LXN,KLXN,"Lexington, NE: Jim Kelly Field"
2886,13133,LXR,HELX,"Luxor, Egypt: Luxor International"
2887,13134,LXS,LGLM,"Lemnos, Greece: Lemnos Airport"
2888,13135,LXV,KLXV,"Leadville, CO: Lake County"
2889,13136,LYB,MWCL,"Little Cayman, Cayman Islands: Edward Bodden"
2890,13137,LYC,ESNL,"Lycksele, Sweden: Lycksele Airport"
2891,13138,LYE,EGDL,"Lyneham, United Kingdom: RAF Lyneham"
2892,13139,LYH,KLYH,"Lynchburg, VA: Lynchburg Regional/Preston Glenn Field"
2893,13140,LYN,LFLY,"Lyon, France: Lyon Bron"
2894,13141,LYP,OPFA,"Faisalabad, Pakistan: Faisalabad International"
2895,13142,LYR,ENSB,"Longyearbyen, Norway: Svalbard"
2896,13143,LYS,LFLL,"Lyon, France: Lyon Saint Exupery"
2897,13144,LYU,KELO,"Ely, MN: Ely Municipal"
2898,13145,LYX,EGMD,"Lydd, United Kingdom: London Ashford"
2899,13146,LZC,MMLC,"Lazaro Cardenas, Mexico: Lazaro Cardenas Airport"
2900,13147,LZH,ZGZH,"Liuzhou, China: Liuzhou Bailian"
2901,13149,LZO,ZULZ,"Luzhou, China: Luzhou Airport"
2902,13150,LZR,YLZI,"Lizard Island, Australia: Lizard Island Airport"
2903,13151,LZU,KLZU,"Lawrenceville, GA: Gwinnett County - Briscoe Field"
2905,13153,MAA,VOMM,"Chennai, India: Chennai International"
2906,13154,MAB,SBMA,"Maraba, Brazil: Joao Correa Da Rocha"
2907,13155,MAC,KMAC,"Macon, GA: Macon Downtown"
2908,13156,MAD,LEMD,"Madrid, Spain: Adolfo Suarez Madrid Barajas"
2909,13157,MAE,KMAE,"Madera, CA: Madera Municipal"
2910,13158,MAF,KMAF,"Midland/Odessa, TX: Midland International Air and Space Port"
2911,13159,MAG,AYMD,"Madang, Papua New Guinea: Madang Airport"
2912,13160,MAH,LEMH,"Mahon, Spain: Menorca"
2913,13161,MAI,FWMG,"Mangochi, Malawi: Mangochi Airport"
2914,13163,MAK,HSSM,"Malakal, South Sudan: Malakal Airport"
2915,13165,MAN,EGCC,"Manchester, United Kingdom: Manchester Airport"
2916,13166,MAO,SBEG,"Manaus, Brazil: Eduardo Gomes International"
2918,13169,MAR,SVMC,"Maracaibo, Venezuela: La Chinita International"
2919,13170,MAS,AYMO,"Manus Island, Papua New Guinea: Momote"
2920,13171,MAT,FZAM,"Matadi, Congo (Kinshasa): Matadi Tshimpi"
2921,13172,MAU,NTTP,"Maupiti, French Polynesia: Maupiti Fr. Polynesia"
2922,13173,MAW,KMAW,"Malden, MO: Malden Regional"
2923,13174,MAX,GOSM,"Matam, Senegal: Matam Ouro Sogui"
2924,13175,MAY,MYAB,"Mangrove Cay, The Bahamas: Clarence A Bain"
2925,13176,MAZ,TJMZ,"Mayaguez, PR: Eugenio Maria de Hostos"
2926,13177,MBA,HKMO,"Mombasa, Kenya: Mombasa Moi International"
2927,13178,MBH,YMYB,"Maryborough, Australia: Maryborough Qld"
2928,13179,MBI,HTMB,"Mbeya, Tanzania: Mbeya Airport"
2929,13180,MBJ,MKJS,"Montego Bay, Jamaica: Sangster International"
2930,13181,MBK,SWXM,"Matupa, Brazil: Matupa Airport"
2931,13182,MBL,KMBL,"Manistee/Ludington, MI: Manistee County-Blacker"
2932,13183,MBO,RPUM,"Mamburao, Philippines: Mamburao Airport"
2933,13184,MBS,KMBS,"Saginaw/Bay City/Midland, MI: MBS International"
2934,13185,MBT,RPVJ,"Masbate, Philippines: Masbate Airport"
2935,13186,MBU,AGGI,"Mbambanakira, Solomon Islands: Mbambanakira Airport"
2936,13187,MBX,LJMB,"Maribor, Slovenia: Maribor Airport"
2937,13188,MBY,KMBY,"Moberley, MO: Omar N Bradley"
2938,13189,MBZ,SWMW,"Maues, Brazil: Maues Airport"
2939,13190,MCA,GUMA,"Macenta, Guinea: Macenta Airport"
2940,13191,MCB,KMCB,"McComb, MS: McComb/Pike County/John E. Lewis Field"
2941,13192,MCC,KMCC,"Sacramento, CA: McClellan Airfield"
2942,13193,MCD,KMCD,"Mackinac Island, MI: Mackinac Island Airport"
2943,13195,MCF,KMCF,"Tampa, FL: Macdill AFB"
2944,13196,MCG,PAMC,"McGrath, AK: McGrath Airport"
2945,13197,MCH,SEMH,"Machala, Ecuador: General Manuel Serrano"
2946,13198,MCI,KMCI,"Kansas City, MO: Kansas City International"
2947,13199,MCJ,SKLM,"Maicao, Colombia: Maicao Airport"
2948,13200,MCK,KMCK,"McCook, NE: McCook Ben Nelson Regional"
2949,13201,MCL,PAIN,"McKinley Park, AK: Denali"
2951,13203,MCN,KMCN,"Macon, GA: Middle Georgia Regional"
2952,13204,MCO,KMCO,"Orlando, FL: Orlando International"
2953,13205,MCP,SBMQ,"Macapa, Brazil: Alberto Alcolumbre"
2954,13206,MCR,MGMM,"Melchor de Mencos, Guatemala: Melchor de Mencos Airport"
2955,13207,MCS,SARM,"Monte Caseros, Argentina: Monte Caseros Airport"
2956,13208,MCT,OOMS,"Muscat, Oman: Muscat International"
2957,13209,MCU,LFBK,"Montlucon, France: Gueret/Lepaud"
2958,13210,MCV,YMHU,"McArthur River, Australia: McArthur River Mine"
2959,13211,MCW,KMCW,"Mason City, IA: Mason City Municipal"
2960,13212,MCY,YBMC,"Maroochydore, Australia: Sunshine Coast"
2961,13213,MCZ,SBMO,"Maceio, Brazil: Zumbi Dos Palmares"
2964,13216,MDC,WAMM,"Menado, Indonesia: Sam Ratulangi"
2965,13217,MDD,KMDD,"Midland/Odessa, TX: Midland Airpark"
2966,13218,MDE,SKRG,"Medellin, Colombia: Jose Maria Cordova"
2967,13219,MDF,KMDZ,"Medford, WI: Taylor County"
2968,13220,MDG,ZYMD,"Mudanjiang, China: Hailang"
2969,13221,MDH,KMDH,"Carbondale, IL: Southern Illinois"
2970,13222,MDI,DNMK,"Makurdi, Nigeria: Makurdi Airport"
2971,13223,MDJ,KS33,"Madras, OR: Madras Municipal"
2972,13224,MDK,FZEA,"Mbandaka, Congo (Kinshasa): Mbandaka Airport"
2973,13226,MDO,PAMD,"Middleton Island, AK: Middleton Island Airport"
2974,13227,MDQ,SAZM,"Mar del Plata, Argentina: Mar del Plata Airport"
2976,13229,MDS,MBMC,"Middle Caicos, Turks and Caicos Islands: Conch Bar"
2977,13230,MDT,KMDT,"Harrisburg, PA: Harrisburg International"
2978,13231,MDU,AYMN,"Mendi, Papua New Guinea: Mendi Airport"
2979,13232,MDW,KMDW,"Chicago, IL: Chicago Midway International"
2980,13233,MDX,SATM,"Mercedes, Argentina: Mercedes Aeroclub"
2981,13234,MDY,PMDY,"Midway Island, TT: Sand Island Field"
2982,13235,MDZ,SAME,"Mendoza, Argentina: El Plumerillo"
2983,13237,MEA,SBME,"Macae, Brazil: Macae Airport"
2984,13238,MEB,YMEN,"Melbourne, Australia: Essendon"
2985,13239,MEC,SEMT,"Manta, Ecuador: Eloy Alfaro International"
2986,13240,MED,OEMA,"Medina, Saudi Arabia: Prince Mohammad Bin Abdulaziz International"
2987,13241,MEI,KMEI,"Meridian, MS: Key Field"
2988,13242,MEJ,KGKJ,"Meadville, PA: Port Meadville"
2989,13243,MEL,YMML,"Melbourne, Australia: Melbourne International"
2990,13244,MEM,KMEM,"Memphis, TN: Memphis International"
2991,13245,MEN,LFNB,"Mende, France: Mende Brenoux"
2992,13246,MEO,KMQI,"Manteo, NC: Dare County Regional"
2993,13247,MEP,WMAU,"Mersing, Malaysia: Mersing Malay."
2994,13248,MEQ,WITC,"Meulaboh, Indonesia: Seunagan"
2995,13249,MER,KMER,"Atwater, CA: Castle"
2996,13250,MES,WIMK,"Medan, Indonesia: Polonia"
2997,13251,MEV,KMEV,"Minden, NV: Minden-Tahoe"
2998,13253,MEY,VNMG,"Meghauli, Nepal: Meghauli Airport"
2999,13254,MFA,HTMA,"Mafia Island, Tanzania: Mafia"
3000,13255,MFD,KMFD,"Mansfield, OH: Mansfield Lahm Regional"
3001,13257,MFF,FOOD,"Moanda, Gabon: Moanda Airport"
3002,13258,MFG,OPMF,"Muzaffarabad, Pakistan: Muzaffarabad Airport"
3003,13259,MFH,K67L,"Mesquite, NV: Mesquite Airport"
3004,13260,MFI,KMFI,"Marshfield, WI: Marshfield Municipal"
3005,13261,MFM,VMMC,"Macau, Macau: Macau International"
3006,13262,MFN,NZMF,"Milford Sound, New Zealand: Milford Sound Airport"
3007,13263,MFQ,DRRM,"Maradi, Niger: Maradi Airport"
3008,13264,MFR,KMFR,"Medford, OR: Rogue Valley International - Medford"
3009,13265,MFS,SKMF,"Miraflores, Colombia: Miraflores Airport"
3011,13267,MFU,FLMF,"Mfuwe, Zambia: Mfuwe Airport"
3012,13268,MFV,KMFV,"Melfa, VA: Accomack County"
3013,13269,MGA,MNMG,"Managua, Nicaragua: Augusto Cesar Sandino International"
3014,13270,MGB,YMTG,"Mount Gambier, Australia: Mount Gambier Airport"
3015,13271,MGC,KMGC,"Michigan City, IN: Michigan City Municipal Phillips Field"
3016,13272,MGD,SLMG,"Magdalena, Bolivia: Magdalena Airport"
3017,13273,MGE,KMGE,"Marietta, GA: Dobbins ARB"
3019,13632,MGE,KMGE,"Marietta, GA: Dobbins ARB"
3021,13274,MGF,SBMG,"Maringa, Brazil: Silvio Name Junior"
3022,13275,MGJ,KMGJ,"Montgomery, NY: Orange County"
3023,13276,MGL,EDLN,"Dusseldorf, Germany: Moenchengladbach"
3024,13277,MGM,KMGM,"Montgomery, AL: Montgomery Regional"
3025,13278,MGN,SKMG,"Magangue, Colombia: Magangue Airport"
3026,13279,MGQ,HCMM,"Mogadishu, Somalia: Aden Adde International"
3027,13280,MGR,KMGR,"Moultrie/Thomasville, GA: Moultrie/Thomasville Airport"
3028,13281,MGS,NCMG,"Mangaia, Cook Islands: Mangaia Cook Island"
3029,13283,MGY,KMGY,"Dayton, OH: Dayton-Wright Brothers"
3030,13284,MHA,SYMD,"Mahdia, Guyana: Mahdia Airport"
3031,13286,MHD,OIMM,"Mashhad, Iran: Shahid Hashemi Nejad International"
3032,13287,MHE,KMHE,"Mitchell, SD: Mitchell Municipal"
3033,13288,MHG,EDFM,"Mannheim, Germany: Mannheim City"
3034,13289,MHH,MYAM,"Marsh Harbour, The Bahamas: Leonard M Thompson International"
3035,13290,MHK,KMHK,"Manhattan/Ft. Riley, KS: Manhattan Regional"
3036,13291,MHL,KMHL,"Marshall, MO: Marshall Memorial Municipal"
3038,13293,MHO,YMHO,"Mount House, Australia: Mount House Airport"
3039,13294,MHQ,EFMA,"Mariehamn, Finland: Mariehamn Airport"
3040,13295,MHR,KMHR,"Sacramento, CA: Sacramento Mather"
3041,13299,MHZ,EGUN,"Mildenhall, United Kingdom: Mildenhall Airport"
3045,13303,MIA,KMIA,"Miami, FL: Miami International"
3046,13304,MIB,KMIB,"Minot, ND: Minot AFB"
3047,13305,MIC,KMIC,"Minneapolis, MN: Crystal"
3048,13307,MIE,KMIE,"Muncie/Anderson/Newcastle, IN: Delaware County Regional"
3049,13308,MII,SBML,"Marilia, Brazil: Frank Miloye Milenkovich"
3050,13309,MIJ,K1Q9,"Mili, Marshall Islands: Mili Airport"
3051,13310,MIK,EFMI,"Mikkeli, Finland: Mikkeli Airport"
3053,13312,MIM,YMER,"Merimbula, Australia: Merimbula Airport"
3054,13313,MIN,YMPA,"Minnipa, Australia: Minnipa Airport"
3055,13314,MIO,KMIO,"Miami, OK: Miami Regional"
3056,13315,MIP,LLMR,"Mitspeh Ramon, Israel: Har Arikha"
3057,13316,MIQ,KMLE,"Omaha, NE: Millard"
3058,13317,MIR,DTMB,"Monastir, Tunisia: Habib Bourguiba International"
3059,13318,MIS,AYMS,"Misima Island, Papua New Guinea: Misima"
3060,13319,MIT,KMIT,"Shafter, CA: Shafter - Minter Field"
3061,13320,MIU,DNMA,"Maiduguri, Nigeria: Maiduguri Airport"
3062,13321,MIV,KMIV,"Millville, NJ: Millville Municipal"
3063,13322,MIW,KMIW,"Marshalltown, IA: Marshalltown Municipal"
3066,13325,MJA,FMSJ,"Manja, Madagascar: Manja Airport"
3068,13327,MJC,DIMN,"Man, Cote d'Ivoire: Man Airport"
3069,13328,MJD,OPMJ,"Moenjodaro, Pakistan: Moenjodaro Airport"
3070,13329,MJF,ENMS,"Mosjoen, Norway: Kjaerstad"
3071,13330,MJG,MUMJ,"Mayajigua, Cuba: Mayajigua Airport"
3072,13331,MJI,HLLM,"Mitiga, Libya: Mitiga International"
3073,13332,MJL,FOGM,"Mouila, Gabon: Mouila Airport"
3074,13333,MJM,FZWA,"Mbuji-Mayi, Congo (Kinshasa): Mbuji Mayi"
3075,13334,MJN,FMNM,"Majunga, Madagascar: Philibert Tsiranana"
3076,13335,MJQ,KMJQ,"Jackson, MN: Jackson Airport"
3077,13336,MJT,LGMT,"Mytilene, Greece: Mitilini"
3078,13337,MJV,LELC,"Murcia, Spain: Murcia San Javier"
3079,13338,MJX,KMJX,"Toms River, NJ: Ocean County"
3080,13339,MJZ,UERR,"Mirny, Russia: Mirny Airport"
3081,13340,MKA,LKMR,"Marianske Lazne, Czech Republic: Marianske Lazne Airport"
3082,13341,MKC,KMKC,"Kansas City, MO: Charles B. Wheeler Downtown"
3083,13342,MKE,KMKE,"Milwaukee, WI: General Mitchell International"
3084,13344,MKG,KMKG,"Muskegon, MI: Muskegon County"
3085,13345,MKI,FEGE,"Obo Mboki, Central African Republic: Obo Mboki Airport"
3086,13346,MKJ,FCOM,"Makoua, Congo (Brazaville): Makoua Airport"
3087,13347,MKK,PHMK,"Hoolehua, HI: Molokai"
3088,13348,MKL,KMKL,"Jackson, TN: McKellar-Sipes Regional"
3089,13349,MKM,WBGK,"Mukah, Malaysia: Mukah Airport"
3090,13350,MKO,KMKO,"Muskogee, OK: Muskogee Davis Regional"
3091,13351,MKP,NTGM,"Makemo, French Polynesia: Makemo Airport"
3092,13352,MKR,YMEK,"Meekatharra, Australia: Meekatharra Airport"
3094,13354,MKT,KMKT,"Mankato, MN: Mankato Regional"
3095,13355,MKU,FOOK,"Makokou, Gabon: Makokou Airport"
3096,13356,MKW,WASR,"Manokwari, Indonesia: Rendani"
3097,13357,MKY,YBMK,"Mackay, Australia: Mackay Airport"
3098,13358,MKZ,WMKM,"Malacca, Malaysia: Malacca Airport"
3099,13359,MLA,LMML,"Malta, Malta: Luqa International"
3100,13361,MLC,KMLC,"McAlester, OK: McAlester Regional"
3101,13362,MLD,KMLD,"Malad City, ID: Malad City Airport"
3102,13363,MLE,VRMM,"Male, Maldives: Velana International"
3103,13364,MLF,KMLF,"Milford, UT: Milford Municipal/Ben and Judy Briscoe Field"
3104,13365,MLG,WARA,"Malang, Indonesia: Abdul Rachman Saleh"
3105,13368,MLK,KM75,"Malta, MT: Malta Airport"
3106,13369,MLL,PADM,"Marshall, AK: Marshall Don Hunter Sr."
3107,13371,MLN,GEML,"Melilla, Spain: Melilla Airport"
3108,13372,MLO,LGML,"Milos, Greece: Milos Airport"
3109,13373,MLP,RPMM,"Malabang, Philippines: Malabang Airport"
3111,13375,MLS,KMLS,"Miles City, MT: Frank Wiley Field"
3112,13376,MLT,KMLT,"Millinocket, ME: Millinocket Municipal"
3113,13377,MLU,KMLU,"Monroe, LA: Monroe Regional"
3114,13378,MLV,YMEU,"Merluna, Australia: Merluna Airport"
3115,13379,MLW,GLMR,"Monrovia, Liberia: Monrovia Spriggs Payne"
3116,13380,MLX,LTAT,"Malatya, Turkey: Malatya Airport"
3117,13381,MLY,PAML,"Manley Hot Springs, AK: Manley Hot Springs Airport"
3118,13382,MLZ,SUMO,"Melo, Uruguay: Melo Airport"
3120,13384,MMB,RJCM,"Memanbetsu, Japan: Memanbetsu Airport"
3121,13385,MMC,MMDM,"Ciudad Mante, Mexico: Cuauhtemoc"
3122,13386,MMD,ROMD,"Minami Daito, Japan: Minami Daito Airport"
3123,13388,MMH,KMMH,"Mammoth Lakes, CA: Mammoth Lakes Airport"
3124,13389,MMI,KMMI,"Athens, TN: McMinn County"
3125,13390,MMJ,RJAF,"Matsumoto, Japan: Matsumoto Airport"
3126,13391,MMK,ULMM,"Murmansk, Russia: Murmansk Airport"
3127,13392,MML,KMML,"Marshall, MN: Southwest Minnesota Regional-Marshall/Ryan Field"
3128,13393,MMM,YMMU,"Middlemount, Australia: Middlemount Airport"
3129,13394,MMN,K6B6,"Stow, MA: Minute Man Air Field"
3130,13395,MMP,SKMP,"Mompos, Colombia: Mompos Airport"
3131,13396,MMQ,FLBA,"Mbala, Zambia: Mbala Airport"
3132,13397,MMT,KMMT,"Columbia, SC: McEntire Jngb"
3133,13398,MMU,KMMU,"Morristown, NJ: Morristown Municipal"
3134,13399,MMX,ESMS,"Malmo, Sweden: Malmo Airport"
3135,13400,MMY,ROMY,"Miyakojima, Japan: Miyako"
3138,13404,MNB,FZAG,"Moanda, Congo (Kinshasa): Muanda"
3139,13405,MNC,FQNC,"Nacala, Mozambique: Nacala International"
3140,13406,MNI,TRPG,"Montserrat, Montserrat: John A Osborne"
3141,13407,MNK,NGMA,"Maiana, Kiribati: Maiana Airport"
3142,13408,MNL,RPLL,"Manila, Philippines: Ninoy Aquino International"
3143,13410,MNN,KMNN,"Marion, OH: Marion Municipal"
3144,13411,MNO,FZRA,"Manono, Congo (Kinshasa): Manono Airport"
3145,13413,MNR,FLMG,"Mongu, Zambia: Mongu Airport"
3146,13414,MNS,FLMA,"Mansa, Zambia: Mansa Airport"
3147,13415,MNT,K51Z,"Minto, AK: Minto Al Wright"
3148,13416,MNU,VYMM,"Mawlamyine, Burma: Mawlamyine Airport"
3149,13417,MNX,SBMY,"Manicore, Brazil: Manicore Airport"
3150,13418,MNZ,KHEF,"Manassas, VA: Manassas Regional/Harry P. Davis Field"
3153,13421,MOA,MUMO,"Moa, Cuba: Orestes Acosta"
3154,13422,MOB,KMOB,"Mobile, AL: Mobile Regional"
3155,13423,MOC,SBMK,"Montes Claros, Brazil: Mario Ribeiro"
3156,13424,MOD,KMOD,"Modesto, CA: Modesto City-County-Harry Sham Field"
3157,13425,MOG,VYMS,"Mong Hsat, Burma: Mong Hsat Airport"
3158,13426,MOL,ENML,"Molde, Norway: Aro"
3159,13427,MOM,GQNL,"Moudjeria, Mauritania: Moudjeria Ledfotar"
3160,13428,MON,NZMC,"Mount Cook, New Zealand: Mount Cook Airport"
3161,13429,MOP,KMOP,"Mount Pleasant, MI: Mount Pleasant Municipal"
3162,13430,MOQ,FMMV,"Morondava, Madagascar: Morondava Airport"
3163,13431,MOR,KMOR,"Morristown, TN: Moore-Murrell"
3164,13432,MOS,KMOS,"Moses Point, AK: Moses Point Airport"
3165,13433,MOT,KMOT,"Minot, ND: Minot International"
3166,13434,MOU,PAMO,"Mountain Village, AK: Mountain Village Airport"
3169,13438,MOZ,NTTM,"Moorea Island, French Polynesia: Temae"
3172,13441,MPJ,KMPJ,"Morrilton, AR: Petit Jean Park"
3174,13443,MPL,LFMT,"Montpellier, France: Montpellier Mediterranee"
3175,13444,MPM,FQMA,"Maputo, Mozambique: Maputo Airport"
3176,13445,MPN,EGYP,"Mount Pleasant, Falkland Islands (Islas Malvinas): Mount Pleasant Airport"
3177,13447,MPR,KMPR,"McPherson, KS: McPherson Airport"
3178,13448,MPS,KOSA,"Mount Pleasant, TX: Mount Pleasant Municipal"
3179,13449,MPT,WPMN,"Maliana, Timor-Leste: Maliana Airport"
3180,13450,MPV,KMPV,"Montpelier/Barre, VT: Edward F Knapp State"
3182,13452,MQB,KMQB,"Macomb, IL: Macomb Municipal"
3183,13453,MQJ,UEMA,"Indianapolis, IN: Indianapolis Regional"
3184,13454,MQL,YMIA,"Mildura, Australia: Mildura Airport"
3185,13455,MQN,ENRA,"Mo I Rana, Norway: Rossvoll"
3186,13456,MQP,FAKN,"Nelspruit, South Africa: Kruger Mpumalanga International"
3187,13457,MQQ,FTTD,"Moundou, Chad: Moundou Airport"
3188,13458,MQS,TVSM,"Mustique, Saint Vincent and the Grenadines: Mustique Airport"
3189,13461,MQY,KMQY,"Smyrna, TN: Smyrna Airport"
3191,13463,MRB,KMRB,"Martinsburg, WV: Eastern WV Regional/Shepherd Field"
3192,13465,MRD,SVMD,"Merida, Venezuela: Alberto Carnevalli"
3193,13466,MRH,EGYM,"Morehead City, NC: Beaufort Morehead City"
3194,13467,MRI,PAMR,"Anchorage, AK: Merrill Field"
3195,13470,MRN,KMRN,"Morganton, NC: Morganton Lenoir"
3197,13472,MRS,LFML,"Marseille, France: Marseille Provence"
3198,13473,MRU,FIMP,"Mauritius Island, Mauritius: Sir Seewoosagur Ramgoolam International"
3199,13474,MRV,URMM,"Mineralnyye Vody, Russia: Mineralnyye Vody Airport"
3200,13475,MRX,OIAM,"Margarita Island, Venezuela: Del Caribe International"
3201,13476,MRY,KMRY,"Monterey, CA: Monterey Regional"
3202,13477,MRZ,YMOR,"Moree, Australia: Moree Airport"
3204,13479,MSA,CZMD,"Muskrat Dam, Canada: Muskrat Dam Airport"
3205,13480,MSC,KFFZ,"Mesa, AZ: Falcon Field"
3206,13481,MSE,EGMH,"Manston, United Kingdom: Manston Airport"
3207,13482,MSH,OOMA,"Masirah, Oman: Masirah Airport"
3208,13483,MSJ,RJSM,"Misawa, Japan: Misawa AB"
3209,13484,MSL,KMSL,"Muscle Shoals, AL: Northwest Alabama Regional"
3210,13485,MSN,KMSN,"Madison, WI: Dane County Regional-Truax Field"
3211,13487,MSP,KMSP,"Minneapolis, MN: Minneapolis-St Paul International"
3212,13488,MSQ,UMMS,"Minsk, Belarus: Minsk 2"
3213,13490,MSS,KMSS,"Massena, NY: Massena International-Richards Field"
3214,13491,MST,EHBK,"Maastricht, Netherlands: Maastricht Aachen"
3215,13492,MSU,FXMM,"Maseru, Lesotho: Moshoeshoe I International"
3216,13493,MSV,KMSV,"Monticello, NY: Sullivan County International"
3217,13494,MSW,HHMS,"Massawa, Eritrea: Massawa International"
3218,13495,MSY,KMSY,"New Orleans, LA: Louis Armstrong New Orleans International"
3219,13496,MSZ,FNMO,"Namibe, Angola: Yuri Gagarin"
3221,13498,MTC,KMTC,"Mt. Clemens, MI: Selfridge Angb"
3222,13499,MTD,YMSF,"Mt. Sandford, Australia: Mount Sanford Station"
3223,13500,MTE,SNMA,"Monte Alegre, Brazil: Monte Alegre Airport"
3224,13501,MTH,KMTH,"Marathon, FL: The Florida Keys Marathon International"
3225,13502,MTJ,KMTJ,"Montrose/Delta, CO: Montrose Regional"
3226,13503,MTL,YMND,"Maitland, Australia: Maitland Airport"
3228,13505,MTN,KMTN,"Baltimore, MD: Martin State"
3229,13506,MTO,KMTO,"Mattoon/Charleston, IL: Coles County Memorial"
3230,13507,MTP,KMTP,"Montauk Point, NY: Sky Portal"
3231,13508,MTR,SKMR,"Monteria, Colombia: Los Garzones"
3232,13509,MTS,FDMS,"Manzini, Swaziland: Matsapha"
3233,13510,MTT,MMMT,"Minatitlan, Mexico: Minatitlan Airport"
3234,13511,MTV,NVSA,"Mota Lava, Vanuatu: Mota Lava Airport"
3235,13512,MTW,KMTW,"Manitowoc, WI: Manitowoc County"
3236,13513,MTX,KMTF,"Fairbanks, AK: Metro Field"
3237,13515,MTZ,LLMZ,"Masada, Israel: Israel Bar Yehuda"
3238,13516,MUA,AGGM,"Munda, Solomon Islands: Munda Airport"
3239,13517,MUB,FBMN,"Maun, Botswana: Maun Airport"
3240,13518,MUC,EDDM,"Munich, Germany: Muenchen"
3241,13520,MUE,PHMU,"Kamuela, HI: Waimea-Kohala"
3242,13521,MUG,MMMG,"Mulege, Mexico: Mulege Airport"
3243,13522,MUH,HEMM,"Mersa Matruh, Egypt: Mersa Matruh Airport"
3244,13523,MUL,KMUL,"Moultrie, GA: Spence"
3245,13524,MUN,SVMT,"Maturin, Venezuela: Jose Tadeo Monagas International"
3246,13525,MUO,KMUO,"Mountain Home, ID: Mountain Home AFB"
3247,13526,MUR,WBGM,"Marudi, Malaysia: Marudi Airport"
3248,13527,MUT,KMUT,"Muscatine, IA: Muscatine Municipal"
3249,13528,MUX,OPMT,"Multan, Pakistan: Multan International"
3250,13530,MUZ,HTMU,"Musoma, Tanzania: Musoma Airport"
3251,13531,MVB,FOON,"Mvengue, Gabon: Mvengue Airport"
3252,13532,MVD,SUMU,"Montevideo, Uruguay: Carrasco International"
3253,13533,MVF,SBMS,"Mossoro, Brazil: Dixsept Rosado"
3255,13535,MVL,KMVL,"Morrisville, VT: Morrisville Stowe State"
3256,13536,MVM,K0V7,"Kayenta, AZ: Kayenta Airport"
3257,13537,MVN,KMVN,"Mount Vernon, IL: Mount Vernon Airport"
3258,13539,MVR,FKKL,"Maroua, Cameroon: Salak"
3259,13540,MVW,KBVS,"Burlington/Mount Vernon, WA: Skagit Regional"
3260,13541,MVY,KMVY,"Martha's Vineyard, MA: Martha's Vineyard Airport"
3261,13543,MWA,KMWA,"Marion/Herrin, IL: Veterans Airport of Southern Illinois"
3262,13544,MWC,KMWC,"Milwaukee, WI: Lawrence J Timmerman"
3263,13545,MWD,OPMI,"Mianwali, Pakistan: Mianwali Airport"
3264,13546,MWH,KMWH,"Moses Lake, WA: Grant County International"
3265,13548,MWM,KMWM,"Windom, MN: Windom Municipal"
3266,13549,MWO,KMWO,"Middletown, OH: Middletown Regional/Hook Field"
3267,13550,MWQ,VYMW,"Magwe, Burma: Magway"
3268,13551,MWZ,HTMW,"Mwanza, Tanzania: Mwanza Airport"
3269,13552,MXB,WAWM,"Masamba, Indonesia: Andi Jemma"
3270,13553,MXC,KU64,"Monticello, UT: Monticello Airport"
3271,13554,MXE,KMEB,"Maxton, NC: Laurinburg-Maxton"
3272,13555,MXF,KMXF,"Montgomery, AL: Maxwell AFB"
3274,13557,MXH,AYMR,"Moro, Papua New Guinea: Moro Airport"
3275,13558,MXJ,DNMN,"Minna, Nigeria: Minna Airport"
3276,13560,MXP,LIMC,"Milan, Italy: Malpensa"
3277,13561,MXS,NSMA,"Maota, Samoa: Maota Airport"
3278,13562,MXT,FMMO,"Maintirano, Madagascar: Maintirano Airport"
3279,13563,MXX,ESKM,"Mora, Sweden: Mora Airport"
3280,13564,MXY,PAMX,"McCarthy, AK: McCarthy Airport"
3281,13565,MYA,YMRY,"Moruya, Australia: Moruya Airport"
3282,13566,MYB,FOOY,"Mayumba, Gabon: Mayumba Airport"
3283,13567,MYC,SVBS,"Maracay, Venezuela: Maracay Airport"
3284,13568,MYD,HKML,"Malindi, Kenya: Malindi Airport"
3285,13569,MYE,RJTQ,"Miyake Jima, Japan: Miyake Jima Airport"
3286,13570,MYF,KMYF,"San Diego, CA: Montgomery Gibbs Executive"
3287,13571,MYG,MYMM,"Mayaguana, The Bahamas: Mayaguana Airport"
3288,13572,MYH,KL41,"Marble Canyon, AZ: Cliff Dwellers"
3289,13573,MYJ,RJOM,"Matsuyama, Japan: Matsuyama Airport"
3290,13574,MYK,KMYK,"May Creek, AK: May Creek Airport"
3291,13575,MYL,KMYL,"McCall, ID: McCall Municipal"
3292,13576,MYP,UTAM,"Mary, Turkmenistan: Mary Airport"
3293,13577,MYR,KMYR,"Myrtle Beach, SC: Myrtle Beach International"
3294,13578,MYT,VYMK,"Myitkyina, Burma: Myitkyina Airport"
3295,13579,MYU,PAMY,"Mekoryuk, AK: Mekoryuk Airport"
3296,13580,MYV,KMYV,"Marysville, CA: Yuba County"
3297,13581,MYW,HTMT,"Mtwara, Tanzania: Mtwara Airport"
3298,13582,MYY,WBGR,"Miri, Malaysia: Miri Airport"
3299,13584,MZB,FQMP,"Mocimboa Da Praia, Mozambique: Mocimboa Da Praia Airport"
3300,13585,MZG,RCQC,"Makung, Taiwan: Ma Kung AB"
3301,13586,MZI,GAMB,"Mopti, Mali: Ambodedjo"
