,id,iata,icao,description
4435,14852,SKE,ENSN,"Skien, Norway: Geiteryggen"
4436,14853,SKF,KSKF,"San Antonio, TX: Kelly Field"
4437,14854,SKG,LGTS,"Thessaloniki, Greece: Makedonia"
4439,14856,SKK,PFSH,"Shaktoolik, AK: Shaktoolik Airport"
4440,14857,SKL,XBRO,"Isle of Skye, United Kingdom: Isle of Skye Airport"
4441,14859,SKO,DNSO,"Sokoto, Nigeria: Sokoto Airport"
4442,14861,SKS,EKSP,"Skrydstrup, Denmark: Skrydstrup Airport"
4443,14862,SKU,LGSY,"Skiros, Greece: Skiros Airport"
4444,14863,SKW,PASW,"Skwentna, AK: Skwentna Airport"
4445,14864,SKX,UWPS,"Saransk, Russia: Saransk Airport"
4447,14866,SKZ,OPSK,"Sukkur, Pakistan: Begum Nusrat Bhutto"
4448,14867,SLA,SASA,"Salta, Argentina: Salta Airport"
4449,14868,SLB,KSLB,"Storm Lake, IA: Storm Lake Municipal"
4450,14869,SLC,KSLC,"Salt Lake City, UT: Salt Lake City International"
4451,14871,SLE,KSLE,"Salem, OR: McNary Field"
4452,14872,SLH,NVSC,"Sola, Vanuatu: Sola Airport"
4453,14873,SLI,FLSW,"Solwezi, Zambia: Solwezi Airport"
4454,14874,SLJ,YSOL,"Chandler, AZ: Stellar Airpark"
4455,14875,SLK,KSLK,"Saranac Lake/Lake Placid, NY: Adirondack Regional"
4456,14876,SLL,OOSA,"Salalah, Oman: Salalah Airport"
4457,14877,SLN,KSLN,"Salina, KS: Salina Regional"
4458,14878,SLO,KSLO,"Salem, IL: Salem/Leckrone"
4459,14880,SLQ,PASL,"Sleetmute, AK: Sleetmute Airport"
4460,14881,SLR,KSLR,"Sulphur Springs, TX: Sulphur Springs Municipal"
4461,14882,SLS,LBSS,"Silistra, Bulgaria: Silistra Polkovnik-Lambrinovo"
4462,14884,SLU,TLPC,"St. Lucia, Saint Lucia: George F Charles"
4463,14885,SLV,VISM,"Shimla, India: Shimla Airport"
4464,14887,SLX,MBSY,"Salt Cay, Turks and Caicos Islands: Salt Cay Airport"
4465,14888,SLZ,SBSL,"Sao Luiz, Brazil: Marechal Cunha Machado International"
4466,14889,SMA,LPAZ,"Santa Maria, Portugal: Santa Maria Airport"
4467,14890,SMB,SCSB,"Cerro El Sombrero, Chile: Franco Bianco"
4469,14892,SME,KSME,"Somerset, KY: Lake Cumberland Regional"
4470,14893,SMF,KSMF,"Sacramento, CA: Sacramento International"
4471,14894,SMI,LGSM,"Samos, Greece: Samos Airport"
4472,14895,SMK,PAMK,"St. Michael, AK: St. Michael Airport"
4473,14896,SML,MYLS,"Stella Maris, The Bahamas: Estate Airstrip"
4474,14897,SMN,KSMN,"Salmon, ID: Lemhi County"
4475,14898,SMO,KSMO,"Santa Monica, CA: Santa Monica Municipal"
4477,14900,SMR,SKSM,"Santa Marta, Colombia: Simon Bolivar"
4478,14901,SMS,FMMS,"St. Marie, Madagascar: Sainte Marie"
4480,14903,SMU,PASP,"Sheep Mountain, AK: Sheep Mountain Airport"
4481,14904,SMV,LSZS,"St. Moritz, Switzerland: Samedan"
4482,14905,SMX,KSMX,"Santa Maria, CA: Santa Maria Public/Capt. G. Allan Hancock Field"
4483,14906,SMY,GOTS,"Simenti, Senegal: Simenti Airport"
4484,14907,SMZ,SMST,"Stoelmanseiland, Suriname: Stoelmanseiland Airport"
4485,14908,SNA,KSNA,"Santa Ana, CA: John Wayne Airport-Orange County"
4486,14909,SNB,YSNB,"Snake Bay, Australia: Snake Bay Airport"
4487,14910,SNC,SESA,"Salinas, Ecuador: General Ulpiano Paez"
4488,14911,SNE,GVSN,"Sao Nicolau, Cape Verde: Preguica"
4489,14912,SNF,SVSP,"San Felipe, Venezuela: Sub Teniente Nestor Arias"
4490,14913,SNG,SLSI,"San Ignacio de Velasco, Bolivia: Cap. Av. Juan Cochamanidis Saucedo"
4491,14914,SNI,GLGE,"Greenville/Sinoe, Liberia: Greenville/Sinoe Airport"
4492,14915,SNK,KSNK,"Snyder, TX: Winston Field"
4493,14916,SNL,KSNL,"Shawnee, OK: Shawnee Regional"
4494,14917,SNM,SLSM,"San Ignacio de Moxos, Bolivia: San Ignacio de Moxos Airport"
4495,14918,SNN,EINN,"Shannon, Ireland: Shannon Airport"
4496,14919,SNP,PASN,"St. Paul, AK: St. Paul Island"
4498,14921,SNR,LFRZ,"St. Nazaire, France: Saint Nazaire Montoir"
4499,14922,SNS,KSNS,"Salinas/Monterey, CA: Salinas Municipal"
4501,14924,SNU,MUSC,"Santa Clara, Cuba: Abel Santamaria International"
4502,14925,SNV,SVSE,"Santa Elena, Venezuela: Wonkin"
4503,14926,SNW,VYTD,"Thandwe, Burma: Thandwe Airport"
4504,14927,SNY,KSNY,"Sidney, NE: Sidney Municipal/Lloyd W. Carr Field"
4505,14928,SOC,WARQ,"Solo City, Indonesia: Adi Soemarmo International"
4506,14929,SOF,LBSF,"Sofia, Bulgaria: Sofia Airport"
4508,14932,SOJ,ENSR,"Sorkjosen, Norway: Sorkjosen Airport"
4509,14933,SOK,FXSM,"Semonkong, Lesotho: Semonkong Airport"
4510,14934,SOL,AK26,"Solomon, AK: Solomon State Field"
4511,14936,SON,NVSS,"Espiritu Santo, Vanuatu: Espiritu"
4512,14938,SOP,KSOP,"Pinehurst/Southern Pines, NC: Moore County"
4513,14939,SOQ,WASS,"Sorong, Indonesia: Sorong Airport"
4514,14941,SOU,EGHI,"Southampton, United Kingdom: Southampton Airport"
4515,14942,SOV,PASO,"Seldovia, AK: Seldovia Airport"
4516,14943,SOW,KSOW,"Show Low, AZ: Show Low Regional"
4518,14946,SPC,GCLA,"Santa Cruz de la Palma, Spain: La Palma"
4519,14947,SPD,VGSD,"Saidpur, Bangladesh: Saidpur Airport"
4520,14948,SPE,WBKO,"Sepulot, Malaysia: Sepulot Airport"
4521,14949,SPF,KSPF,"Spearfish, SD: Black Hills Clyde Ice Field"
4522,14950,SPG,KSPG,"Tampa, FL: Albert Whitted"
4524,14952,SPI,KSPI,"Springfield, IL: Abraham Lincoln Capital"
4526,14954,SPM,ETAD,"Spangdahlem, Germany: Spangdahlem AB"
4527,14955,SPN,PGSN,"Saipan, TT: Francisco C. Ada Saipan International"
4528,14957,SPP,FNME,"Menongue, Angola: Menongue Airport"
4531,14960,SPS,KSPS,"Wichita Falls, TX: Sheppard AFB/Wichita Falls Municipal"
4532,14961,SPU,LDSP,"Split, Croatia: Split Airport"
4533,14962,SPW,KSPW,"Spencer, IA: Spencer Municipal"
4534,14963,SPY,DISP,"San Pedro, Cote d'Ivoire: San Pedro Airport"
4535,14964,SPZ,KASG,"Springdale, AR: Springdale Municipal"
4536,14966,SQI,KSQI,"Sterling/Rockfalls, IL: Whiteside County-Jos H. Bittorf Field"
4537,14967,SQL,KSQL,"San Carlos, CA: San Carlos Airport"
4538,14968,SQN,WAPN,"Sanana, Indonesia: Emalamo"
4539,14969,SQO,ESUD,"Storuman, Sweden: Storuman Airport"
4540,14970,SQQ,EYSA,"Siauliai, Lithuania: Siauliai International"
4541,14971,SQR,WAWS,"Soroako, Indonesia: Soroako Airport"
4542,14972,SQV,KW28,"Sequim, WA: Sequim Valley"
4543,14974,SRB,SLSR,"Santa Rosa, Bolivia: Santa Rosa Airport"
4544,14975,SRC,KSRC,"Searcy, AR: Searcy Municipal"
4545,14976,SRE,SLAL,"Sucre, Bolivia: Juana Azurduy de Padilla"
4546,14977,SRF,CA35,"Novato, CA: Hamilton AFB"
4547,14979,SRH,FTTA,"Sarh, Chad: Sarh Airport"
4549,14981,SRJ,SLSB,"San Borja, Bolivia: Capitan German Quiroga Guardia"
4551,14983,SRN,YSRN,"Strahan, Australia: Strahan Airport"
4553,14985,SRP,ENSO,"Stord, Norway: Stord Airport"
4554,14986,SRQ,KSRQ,"Sarasota/Bradenton, FL: Sarasota/Bradenton International"
4555,14987,SRV,KSRV,"Stony River, AK: Stony River Airport"
4556,14988,SRW,KRUQ,"Salisbury, NC: Mid Carolina Regional"
4557,14989,SRX,HLGD,"Sert, Libya: Sirte International"
4558,14990,SRZ,SLET,"Santa Cruz, Bolivia: El Trompillo"
4559,14991,SSA,SBSV,"Salvador, Brazil: Deputado Luis Eduardo Magalhaes International"
4561,14993,SSC,KSSC,"Sumter, SC: Shaw AFB"
4562,14994,SSG,FGSL,"Malabo, Equatorial Guinea: Malabo Airport"
4563,14995,SSH,HESH,"Sharm El Sheikh, Egypt: Sharm El Sheikh International"
4566,15000,SSN,RKSM,"Seoul, South Korea: Seoul AB"
4568,15002,SST,SAZL,"Santa Teresita, Argentina: Santa Teresita Airport"
4569,15003,SSW,7WA5,"Stuart Island, WA: Stuart Island Airpark"
4570,15004,SSX,LTAQ,"Samsun, Turkey: Samsun Airport"
4571,15005,SSY,FNBC,"Mbanza Congo, Angola: Mbanza Congo Airport"
4572,15006,STA,EKVJ,"Stauning, Denmark: Stauning Airport"
4573,15007,STB,SVSZ,"Santa Barbara, Venezuela: Santa Barbara Airport"
4574,15008,STC,KSTC,"St. Cloud, MN: St. Cloud Regional"
4575,15009,STD,SVSO,"Santo Domingo, Venezuela: Mayor Guerrero Vivas"
4576,15010,STE,KSTE,"Stevens Point, WI: Stevens Point Municipal"
4578,15012,STG,PAPB,"St. George Island, AK: St. George Island Airport"
4579,15013,STI,MDST,"Santiago, Dominican Republic: Cibao International"
4580,15014,STJ,KSTJ,"St. Joseph, MO: Rosecrans Memorial"
4581,15015,STK,KSTK,"Sterling, CO: Sterling Municipal"
4582,15016,STL,KSTL,"St. Louis, MO: St Louis Lambert International"
4583,15017,STM,SBSN,"Santarem, Brazil: Eduardo Gomes"
4584,15018,STN,EGSS,"London, United Kingdom: London Stansted"
4586,15020,STP,KSTP,"Minneapolis/St. Paul, MN: St. Paul Downtown Holman Field"
4587,15021,STQ,KOYM,"St. Marys, PA: St. Marys Municipal"
4588,15022,STR,EDDS,"Stuttgart, Germany: Stuttgart Airport"
4589,15023,STS,KSTS,"Santa Rosa, CA: Charles M. Schulz - Sonoma County"
4590,15024,STT,TIST,"Charlotte Amalie, VI: Cyril E King"
4591,15026,STW,URMT,"Stavropol, Russia: Shpakovskoye"
4592,15027,STX,TISX,"Christiansted, VI: Henry E. Rohlsen"
4593,15028,STY,SUSO,"Salto, Uruguay: Nueva Hesperides International"
4594,15029,STZ,SWST,"Santa Terezinha, Brazil: Santa Terezinha Airport"
4595,15030,SUA,KSUA,"Stuart, FL: Witham Field"
4596,15031,SUB,WARR,"Surabaya, Indonesia: Juanda"
4598,15033,SUE,KSUE,"Sturgeon Bay, WI: Door County Cherryland"
4599,15034,SUF,LICA,"Lamezia Terme, Italy: Lamezia Terme Airport"
4600,15035,SUG,RPMS,"Surigao, Philippines: Surigao Airport"
4601,15036,SUI,UGSS,"Sukhumi, Georgia: Babusheri"
4602,15037,SUJ,LRSM,"Satu Mare, Romania: Satu Mare Airport"
4603,15039,SUL,OPSU,"Sui, Pakistan: Sui Airport"
4604,15040,SUM,KSMS,"Sumter, SC: Sumter Airport"
4605,15041,SUN,KSUN,"Sun Valley/Hailey/Ketchum, ID: Friedman Memorial"
4606,15042,SUO,KS21,"Sunriver, OR: Sunriver Airport"
4607,15043,SUS,KSUS,"St. Louis, MO: Spirit of St. Louis"
4608,15044,SUT,HTSU,"Sumbawanga, Tanzania: Sumbawanga Airport"
4609,15045,SUU,KSUU,"Fairfield, CA: Travis AFB"
4610,15046,SUV,NFNA,"Suva, Fiji: Nausori International"
4611,15047,SUW,KSUW,"Superior, WI: Richard I Bong"
4612,15049,SVA,PASA,"Savoonga, AK: Savoonga Airport"
4613,15050,SVB,FMNS,"Sambava, Madagascar: Sambava Airport"
4614,15051,SVC,KSVC,"Silver City/Hurley, NM: Grant County"
4615,15052,SVD,TVSV,"St. Vincent, Saint Vincent and the Grenadines: E. T. Joshua"
4616,15054,SVH,KSVH,"Statesville, NC: Statesville Regional"
4617,15055,SVJ,ENSH,"Svolvaer, Norway: Helle"
4618,15056,SVL,EFSA,"Savonlinna, Finland: Savonlinna Airport"
4619,15057,SVN,KSVN,"Savannah, GA: Hunter AAF"
4620,15058,SVO,UUEE,"Moscow, Russia: Sheremetyevo"
4621,15059,SVP,FNKU,"Kuito, Angola: Kuito Airport"
4622,15060,SVQ,LEZL,"Seville, Spain: Seville Airport"
4623,15061,SVS,PFSV,"Stevens Village, AK: Stevens Village Airport"
4624,15062,SVU,NFNS,"Savusavu, Fiji: Savusavu Airport"
4625,15063,SVW,PASV,"Sparrevohn, AK: Sparrevohn LRRS"
4626,15064,SVX,USSS,"Ekaterinburg, Russia: Koltsovo"
4627,15065,SVZ,SVSA,"San Antonio, Venezuela: Juan Vicente Gomez International"
4628,15066,SWA,ZGOW,"Shantou, China: Waisha"
4630,15068,SWC,YSWL,"Stawell, Australia: Stawell Airport"
4631,15069,SWD,PAWD,"Seward, AK: Seward Airport"
4634,15074,SWO,KSWO,"Stillwater, OK: Stillwater Regional"
4635,15075,SWQ,WADS,"Sumbawa, Indonesia: Sumbawa Besar"
4636,15076,SWS,EGFH,"Swansea, United Kingdom: Swansea Airport"
4637,15077,SWU,RKSW,"Suwon, South Korea: Suwon Airport"
4638,15078,SWW,KSWW,"Sweetwater, TX: Avenger Field"
4639,15079,SXB,LFST,"Strasbourg, France: Strasbourg Entzheim"
4640,15080,SXE,YWSL,"Sale, Australia: West Sale"
4641,15082,SXG,FLSN,"Senanga, Zambia: Senanga Airport"
4642,15083,SXL,EISG,"Sligo, Ireland: Sligo Airport"
4643,15084,SXM,TNCM,"Philipsburg, Sint Maarten: Princess Juliana International"
4644,15085,SXP,KSXP,"Sheldon Point, AK: Nunam Iqua"
4645,15086,SXQ,PASX,"Soldotna, AK: Soldotna Airport"
4646,15087,SXR,VISR,"Srinagar, India: Srinagar Airport"
4647,15088,SXU,HASD,"Soddu, Ethiopia: Soddu Airport"
4648,15089,SXY,KN23,"Sidney, NY: Sidney Municipal"
4649,15090,SYA,PASY,"Shemya, AK: Eareckson AS"
4651,15092,SYD,YSSY,"Sydney, Australia: Sydney International"
4652,15093,SYI,KSYI,"Shelbyville/Tullahoma, TN: Bomar Field-Shelbyville Municipal"
4653,15095,SYO,RJSY,"Shonai, Japan: Shonai Airport"
4654,15096,SYR,KSYR,"Syracuse, NY: Syracuse Hancock International"
4655,15097,SYT,LFLN,"Saint-Yan, France: Saint-Yan Airport"
4656,15098,SYX,ZJSY,"Sanya, China: Phoenix International"
4657,15099,SYY,EGPO,"Stornoway, United Kingdom: Stornoway Airport"
4658,15100,SYZ,OISS,"Shiraz, Iran: Shahid Dastghaib International"
4659,15101,SZA,FNSO,"Soyo, Angola: Soyo Airport"
4662,15105,SZF,LTFH,"Samsun, Turkey: Carsamba"
4663,15106,SZG,LOWS,"Salzburg, Austria: Salzburg Airport"
4664,15107,SZK,FASZ,"Skukuza, South Africa: Skukuza Airport"
4665,15108,SZL,KSZL,"Knob Noster, MO: Whiteman AFB"
4667,15110,SZP,KSZP,"Santa Paula, CA: Santa Paula Airport"
4668,15111,SZT,MMSC,"San Cristobal, Mexico: San Cristobal de Las Casas"
4669,15112,SZW,EDOP,"Schwerin, Germany: Schwerin Parchim"
4670,15113,SZX,ZGSZ,"Shenzhen, China: Bao'an International"
4671,15114,SZZ,EPSC,"Szczecin, Poland: Goleniow"
4672,15115,TAB,TTCP,"Tobago, Trinidad and Tobago: A N R Robinson International"
4673,15116,TAC,RPVA,"Tacloban, Philippines: Daniel Z. Romualdez"
4674,15117,TAD,KTAD,"Trinidad, CO: Las Animas County"
4675,15118,TAE,RKTN,"Taegu, South Korea: Taegu International"
4676,15119,TAF,DAOL,"Oran, Algeria: Tafaraoui"
4677,15120,TAG,RPVT,"Tagbilaran, Philippines: Tagbilaran Airport"
4678,15121,TAH,NVVW,"Tanna Island, Vanuatu: Tanna Island Airport"
4679,15122,TAI,OYTZ,"Taiz, Yemen: Taiz International"
4680,15123,TAK,RJOT,"Takamatsu, Japan: Takamatsu Airport"
4681,15124,TAL,PATA,"Tanana, AK: Ralph M Calhoun Memorial"
4682,15127,TAO,ZSQD,"Qingdao, China: Liuting"
4683,15128,TAP,MMTP,"Tapachula, Mexico: Tapachula International"
4684,15129,TAR,LIBG,"Taranto, Italy: Taranto Grottaglie"
4686,15133,TAX,WAPT,"Taliabu, Indonesia: Taliabu Airport"
4687,15134,TBB,VVTH,"Tuy Hoa, Vietnam: Tuy Hoa Airport"
4688,15135,TBF,NGTE,"Tabiteuea, Kiribati: Tabiteuea Airport"
4689,15136,TBI,MYCB,"New Bight, The Bahamas: The Bight"
4690,15137,TBL,YTAB,"Tableland, Australia: Tableland Airport"
4691,15138,TBN,KTBN,"Fort Leonard Wood, MO: Waynesville-St. Robert Regional Forney Field"
4692,15139,TBO,HTTB,"Tabora, Tanzania: Tabora Airport"
4693,15140,TBP,SPME,"Tumbes, Peru: Cap. FAP Pedro Canga Rodriguez"
4694,15141,TBR,KTBR,"Statesboro, GA: Statesboro-Bulloch County"
4695,15142,TBS,UGTB,"Tbilisi, Georgia: Tbilisi Airport"
4696,15143,TBT,SBTT,"Tabatinga, Brazil: Tabatinga Airport"
4697,15144,TBU,NFTF,"Tonga Tapu, Tonga: Fua Amotu International"
4698,15145,TBZ,OITT,"Tabriz, Iran: Tabriz International"
4699,15146,TCA,YTNK,"Tennant Creek, Australia: Tennant Creek Airport"
4700,15147,TCB,MYAT,"Treasure Cay, The Bahamas: Treasure Cay Airport"
4701,15148,TCC,KTCC,"Tucumcari, NM: Tucumcari Municipal"
4703,15151,TCH,FOOT,"Tchibanga, Gabon: Tchibanga Airport"
4705,15154,TCM,KTCM,"Tacoma, WA: McChord Field"
4706,15155,TCN,MMHC,"Tehuacan, Mexico: Tehuacan Airport"
4707,15156,TCO,SKCO,"Tumaco, Colombia: La Florida"
4708,15157,TCP,HETB,"Taba, Egypt: Taba International"
4709,15158,TCQ,SPTN,"Tacna, Peru: Coronel Carlos Ciriani Santa Rosa International"
4710,15159,TCS,KTCS,"Truth Or Consequences, NM: Truth Or Consequences Municipal"
4711,15160,TCT,PPCT,"Takotna, AK: Takotna Airport"
4712,15161,TDA,SKTD,"Trinidad, Colombia: San Luis de Palenque"
4713,15162,TDD,SLTR,"Trinidad, Bolivia: Tte Av Jorge Henrich Arauz International"
4714,15164,TDW,KTDW,"Amarillo, TX: Tradewind"
4715,15165,TDZ,KTDZ,"Toledo, OH: Metcalf Field"
4716,15166,TEA,MHTE,"Tela, Honduras: Tela Airport"
4717,15167,TEB,KTEB,"Teterboro, NJ: Teterboro Airport"
4718,15168,TED,EKTS,"Thisted, Denmark: Thisted Airport"
4719,15170,TEH,K3T4,"Tetlin, AK: Tetlin Airport"
4720,15171,TEK,PAKA,"Tatitlek, AK: Tatitlek Airport"
4722,15174,TER,LPLA,"Lajes, Portugal: Lajes Airport"
4723,15175,TET,FQTT,"Tete, Mozambique: Tete Chingodzi"
4724,15176,TEU,NZMO,"Te Anau, New Zealand: Te Anau Airport"
4725,15177,TEX,KTEX,"Telluride, CO: Telluride Regional"
4726,15178,TEZ,VETZ,"Tezpur, India: Tezpur Airport"
4727,15180,TFI,AYTU,"Tufi, Papua New Guinea: Tufi Airport"
4728,15181,TFN,GCXO,"Tenerife, Spain: Tenerife Norte"
4729,15183,TFS,GCTS,"Tenerife, Spain: Tenerife Sur"
4730,15184,TGD,LYPG,"Podgorica, Montenegro: Podgorica Airport"
4732,15186,TGG,WMKN,"Kuala Trengganu, Malaysia: Kuala Trengganu Airport"
4733,15187,TGH,NVST,"Tongoa, Vanuatu: Tongoa Airport"
4734,15188,TGI,SPGM,"Tingo Maria, Peru: Tingo Maria Airport"
4735,15189,TGM,LRTM,"Targu Mures, Romania: Targu Mures Airport"
4736,15190,TGR,DAUK,"Touggourt, Algeria: Touggourt/Sidi Mahdi"
4737,15191,TGT,HTTG,"Tanga, Tanzania: Tanga Airport"
4738,15192,TGU,MHTG,"Tegucigalpa, Honduras: Toncontin International"
4739,15195,THA,KTHA,"Tullahoma, TN: Tullahoma Regional Airport/William Northern Field"
4740,15196,THE,SBTE,"Teresina, Brazil: Senador Petronio Portella"
4743,15198,ZBL,YTNG,"Biloela, Australia: Biloela (Thangool)"
4745,16289,ZBL,YTNG,"Biloela, Australia: Biloela (Thangool)"
4746,15199,THN,ESGT,"Trollhattan, Sweden: Trollhattan Vanersborg"
4748,15201,THR,OIII,"Tehran, Iran: Mehrabad International"
4749,15202,THU,BGTL,"Thule, Greenland: Thule Air Base"
4750,15203,THV,KTHV,"York, PA: York Airport"
4751,15204,THZ,DRRT,"Tahoua, Niger: Tahoua Airport"
4752,15205,TIA,LATI,"Tirana, Albania: Tirana International"
4753,15207,TIE,HATP,"Tippi, Ethiopia: Tippi Airport"
4754,15208,TIF,OETF,"Taif, Saudi Arabia: Taif International"
4755,15209,TIH,NTGC,"Tikehau, French Polynesia: Tikehau Airport"
4756,15211,TIK,KTIK,"Oklahoma City, OK: Tinker AFB"
4757,15212,TIM,WABP,"Tembagapura, Indonesia: Mozes Kilangin"
4758,15213,TIN,DAOF,"Tindouf, Algeria: Tindouf Airport"
4759,15214,TIP,HLLT,"Tripoli, Libya: Tripoli International"
4760,15215,TIQ,PGWT,"Tinian, TT: Tinian International"
4761,15216,TIR,VOTP,"Tirupati, India: Tirupati Airport"
4763,15218,TIU,NZTU,"Timaru, New Zealand: Timaru Airport"
4764,15219,TIV,LYTV,"Tivat, Montenegro: Tivat Airport"
4765,15220,TIW,KTIW,"Tacoma, WA: Tacoma Narrows"
4766,15221,TIX,KTIX,"Titusville, FL: Space Coast Regional"
4767,15222,TIY,GQND,"Tidjikja, Mauritania: Tidjikja Airport"
4768,15223,TIZ,AYTA,"Tari, Papua New Guinea: Tari Airport"
4769,15224,TJA,SLTJ,"Tarija, Bolivia: Cap Av Oriel Lea Plaza International"
4770,15225,TJI,MHTJ,"Trujillo, Honduras: Trujillo Airport"
4771,15226,TJM,USTR,"Tyumen, Russia: Roshchino"
4773,15228,TKA,PATK,"Talkeetna, AK: Talkeetna Airport"
4774,15229,TKC,FKKC,"Tiko, Cameroon: Tiko Airport"
4775,15230,TKD,DGTK,"Takoradi, Ghana: Takoradi Airport"
4777,15232,TKF,KTRK,"Truckee, CA: Truckee Tahoe"
4778,15233,TKG,WICT,"Bandar Lampung, Indonesia: Branti"
4779,15234,TKH,VTPI,"Takhli, Thailand: Takhli Airport"
4781,15236,TKJ,PFTO,"Tok, AK: Tok Junction"
4782,15237,TKK,PTKK,"Chuuk, Federated States of Micronesia: Chuuk International"
4785,15240,TKQ,HTKA,"Kigoma, Tanzania: Kigoma Airport"
4786,15241,TKR,VGSG,"Thakurgaon, Bangladesh: Thakurgaon Stol Port"
4787,15242,TKS,RJOS,"Tokushima, Japan: Tokushima Airport"
4788,15243,TKT,VTPT,"Tak, Thailand: Tak Airport"
4789,15244,TKU,EFTU,"Turku, Finland: Turku Airport"
4790,15245,TLA,PATE,"Teller, AK: Teller Airport"
4791,15247,TLE,FMST,"Tulear, Madagascar: Tulear Airport"
4792,15248,TLF,K2K5,"Telida, AK: Telida Airport"
4793,15249,TLH,KTLH,"Tallahassee, FL: Tallahassee International"
4794,15250,TLJ,PATL,"Tatalina, AK: Tatalina LRRS"
4795,15252,TLL,EETN,"Tallinn, Estonia: Lennart Meri Tallinn"
4796,15253,TLM,DAON,"Tlemcen, Algeria: Zenata-Messali El Hadj"
4797,15254,TLN,LFTH,"Toulon/Hyeres, France: Hyeres Le Palyvestre"
4798,15255,TLR,KTLR,"Tulare, CA: Mefford Field"
4799,15256,TLS,LFBO,"Toulouse, France: Toulouse Blagnac"
4800,15257,TLT,PALT,"Tuluksak, AK: Tuluksak Airport"
4801,15258,TLV,LLBG,"Tel Aviv, Israel: Ben Gurion"
4802,15259,TMA,KTMA,"Tifton, GA: Henry Tift Myers"
4803,15260,TMB,KTMB,"Miami, FL: Miami Executive"
4804,15261,TMD,GQNH,"Timbedra, Mauritania: Timbedra Airport"
4805,15262,TMI,VNTR,"Tumlingtar, Nepal: Tumlingtar Airport"
4806,15263,TML,DGLE,"Tamale, Ghana: Tamale Airport"
4807,15264,TMM,FMMT,"Tamatave, Madagascar: Toamasina"
4808,15265,TMP,EFTP,"Tampere, Finland: Tampere-Pirkkala"
4809,15266,TMR,DAAT,"Tamanrasset, Algeria: Aguemar"
4810,15267,TMS,FPST,"Sao Tome Island, Sao Tome and Principe: Salazar"
4811,15268,TMT,SBTB,"Trombetas, Brazil: Trombetas Airport"
4812,15269,TMW,YSTW,"Tamworth, Australia: Tamworth Airport"
4819,15277,TNA,ZSJN,"Jinan, China: Yaoqiang"
4820,15278,TNC,PATC,"Tin City, AK: Tin City LRRS"
4821,15279,TNE,RJFG,"Tanegashima, Japan: Tanegashima Airport"
4822,15280,TNG,GMTT,"Tangier, Morocco: Tanger Ibn Batouta International"
4823,15281,TNJ,WIDN,"Tandjungpinang, Indonesia: Kidjang"
4824,15282,TNK,POKA,"Tununak, AK: Tununak Airport"
4825,15283,TNN,RCNN,"Tainan, Taiwan: Tainan Airport"
4826,15284,TNP,KTNP,"Twentynine Palms, CA: Twentynine Palms Airport"
4827,15285,TNR,FMMI,"Antananarivo, Madagascar: Ivato"
4828,15286,TNT,KTNT,"Miami, FL: Dade-Collier Training and Transition"
4829,15287,TNU,KTNU,"Newton, IA: Newton Municipal Earl Johnson Field"
4830,15288,TNX,VDST,"Stung Treng, Cambodia: Stung Treng Airport"
4831,15289,TOA,KTOA,"Torrance, CA: Zamperini Field"
4832,15290,TOB,HLGN,"Tobruk, Libya: Tobruk Airport"
4833,15292,TOE,DTTZ,"Tozeur, Tunisia: Nefta"
4834,15293,TOG,PATG,"Togiak, AK: Togiak Airport"
4835,15294,TOJ,LETO,"Madrid, Spain: Torrejon AFB"
4836,15296,TOM,GATB,"Tombouctou, Mali: Tombouctou Airport"
4837,15297,TOP,KTOP,"Topeka, KS: Philip Billard Municipal"
4838,15298,TOQ,SCBE,"Tocopilla, Chile: Barriles"
4839,15299,TOR,KTOR,"Torrington, WY: Torrington Municipal"
4840,15301,TOU,NWWU,"Touho, New Caledonia: Touho Airport"
4842,15303,TOY,RJNT,"Toyama, Japan: Toyama Airport"
4843,15304,TPA,KTPA,"Tampa, FL: Tampa International"
4845,15306,TPE,RCTP,"Taipei, Taiwan: Taiwan Taoyuan International"
4846,15307,TPF,KTPF,"Tampa, FL: Peter O'Knight"
4847,15308,TPH,KTPH,"Tonopah, NV: Tonopah Airport"
4848,15309,TPI,AYTI,"Tapini, Papua New Guinea: Tapini Airport"
4849,15310,TPL,KTPL,"Temple, TX: Draughon-Miller Central Texas Regional"
4850,15312,TPP,SPST,"Tarapoto, Peru: Tarapoto Airport"
4851,15314,TPR,YTMP,"Tom Price, Australia: Tom Price Airport"
4852,15315,TPS,LICT,"Trapani/Marsala, Italy: Trapani/Birgi"
4853,15316,TRB,SKTU,"Turbo, Colombia: Turbo Airport"
4854,15317,TRC,MMTC,"Torreon, Mexico: Torreon International"
4855,15319,TRE,EGPU,"Tiree Island, United Kingdom: Tiree Island Airport"
4856,15320,TRF,ENTO,"Sandefjord, Norway: Torp"
4857,15321,TRG,NZTG,"Tauranga, New Zealand: Tauranga Airport"
4858,15322,TRH,KL72,"Trona, CA: Trona Airport"
4859,15323,TRI,KTRI,"Bristol/Johnson City/Kingsport, TN: Tri Cities"
4860,15324,TRK,WALR,"Tarakan, Indonesia: Juwata"
4861,15325,TRM,KTRM,"Thermal, CA: Jacqueline Cochran Regional"
4862,15326,TRN,LIMF,"Turin, Italy: Torino"
4863,15327,TRO,YTRE,"Taree, Australia: Taree Airport"
4864,15328,TRR,VCCT,"Trincomalee, Sri Lanka: China Bay"
4865,15329,TRS,LIPQ,"Trieste, Italy: Trieste Airport"
4866,15332,TRV,VOTV,"Trivandrum, India: Thiruvananthapuram International"
4867,15333,TRW,NGTA,"Tarawa, Kiribati: Bonriki International"
4868,15334,TRZ,VOTR,"Trichinopoly, India: Tiruchirappalli International"
4869,15335,TSA,RCSS,"Taipei, Taiwan: Taipei Songshan"
4870,15336,TSB,FYTM,"Tsumeb, Namibia: Tsumeb Airport"
4871,15338,TSF,LIPH,"Venice, Italy: Treviso"
4872,15339,TSG,KTSG,"Tanacross, AK: Tanacross Airport"
4873,15340,TSH,FZUK,"Tshikapa, Congo (Kinshasa): Tshikapa Airport"
4874,15341,TSJ,RJDT,"Tsushima, Japan: Tsushima Airport"
4875,15342,TSM,KSKX,"Taos, NM: Taos Regional"
4876,15344,TSP,KTSP,"Tehachapi, CA: Tehachapi Municipal"
4877,15345,TSR,LRTR,"Timisoara, Romania: Traian Vuia"
4879,15349,TTB,LIET,"Tortoli, Italy: Tortoli Arbatax"
4880,15350,TTC,SCTT,"Taltal, Chile: Argolla"
4881,15351,TTD,KTTD,"Troutdale, OR: Portland Troutdale"
4882,15352,TTG,SAST,"Tartagal, Argentina: Tartagal Airport"
4883,15353,TTH,OOTH,"Thumrait, Oman: Thumrait Airport"
4884,15354,TTJ,RJOR,"Tottori, Japan: Tottori Airport"
4886,15356,TTN,KTTN,"Trenton, NJ: Trenton Mercer"
4887,15358,TTS,FMNT,"Tsaratanana, Madagascar: Tsaratanana Airport"
4888,15359,TTT,RCFN,"Taitung, Taiwan: Fongnian"
4889,15360,TTU,GMTN,"Tetuan, Morocco: Tetouan/Sania Ramel"
4890,15361,TUA,SETU,"Tulcan, Ecuador: Tulcan Airport"
4891,15362,TUB,NTAT,"Tubuai Island, French Polynesia: Tubuai Is Fr. Polynesia"
4892,15363,TUC,SANT,"Tucuman, Argentina: Tucuman Airport"
4893,15364,TUD,GOTT,"Tambacounda, Senegal: Tambacounda Airport"
4894,15365,TUF,LFOT,"Tours, France: Tours Val de Loire"
4895,15366,TUG,RPUT,"Tuguegarao, Philippines: Tuguegarao Airport"
4897,15368,TUI,OETR,"Turaif, Saudi Arabia: Turaif Airport"
4898,15369,TUK,OPTU,"Turbat, Pakistan: Turbat International"
4899,15370,TUL,KTUL,"Tulsa, OK: Tulsa International"
4900,15371,TUM,YTMU,"Tumut, Australia: Tumut Airport"
4901,15372,TUN,DTTA,"Tunis, Tunisia: Carthage"
4902,15373,TUO,NZAP,"Taupo, New Zealand: Taupo Airport"
4903,15374,TUP,KTUP,"Tupelo, MS: Tupelo Regional"
4904,15375,TUR,SBTU,"Tucurui, Brazil: Tucurui Airport"
4905,15376,TUS,KTUS,"Tucson, AZ: Tucson International"
4907,15378,TUU,OETB,"Tabuk, Saudi Arabia: Prince Sultan Bin Abdulaziz"
4908,15379,TVA,FMMR,"Morafenobe, Madagascar: Morafenobe Airport"
4909,15380,TVC,KTVC,"Traverse City, MI: Cherry Capital"
4910,15381,TVF,KTVF,"Thief River Falls, MN: Thief River Falls Regional"
4911,15382,TVI,KTVI,"Thomasville, GA: Thomasville Regional"
4912,15383,TVL,KTVL,"Lake Tahoe, CA: Lake Tahoe Airport"
4913,15384,TVU,NFNM,"Taveuni, Fiji: Matei"
4914,15385,TWA,KA63,"Twin Hills, AK: Twin Hills Airport"
4915,15386,TWB,YTWB,"Toowoomba, Australia: Toowoomba Airport"
4916,15387,TWD,K0S9,"Port Townsend, WA: Jefferson County International"
4917,15388,TWE,AK49,"Taylor, AK: Taylor Airport"
4918,15389,TWF,KTWF,"Twin Falls, ID: Joslin Field - Magic Valley Regional"
4920,15392,TWU,WBKW,"Tawau, Malaysia: Tawau Airport"
4928,15400,TXG,RCLG,"Taichung, Taiwan: Taichung Airport"
4929,15401,TXK,KTXK,"Texarkana, AR: Texarkana Regional-Webb Field"
4930,15402,TXL,EDDT,"Berlin, Germany: Tegel"
4931,15403,TXN,ZSTX,"Tunxi, China: Tunxi Airport"
4932,15404,TXU,DITB,"Tabou, Cote d'Ivoire: Tabou Airport"
4933,15405,TYB,YTIB,"Tibooburra, Australia: Tibooburra Airport"
4934,15406,TYE,KTYE,"Tyonek, AK: Tyonek Airport"
4935,15408,TYL,SPYL,"Talara, Peru: Capitan FAP Victor Montes International"
4936,15409,TYN,ZBYN,"Taiyuan, China: Wusu"
4938,15411,TYR,KTYR,"Tyler, TX: Tyler Pounds Regional"
4939,15412,TYS,KTYS,"Knoxville, TN: McGhee Tyson"
4940,15413,TYZ,KTYL,"Taylor, AZ: Taylor Airport"
4943,15416,TZL,LQTZ,"Tuzla, Bosnia and Herzegovina: Tuzla Airport"
