,id,iata,icao,description
1121,11193,CVG,KCVG,"Cincinnati, OH: Cincinnati/Northern Kentucky International"
1123,11198,CVO,KCVO,"Corvallis, OR: Corvallis Municipal"
1124,11199,CVQ,YCAR,"Carnarvon, Australia: Carnarvon Airport"
1125,11200,CVS,KCVS,"Clovis, NM: Cannon AFB"
1126,11201,CVT,EGBE,"Coventry, United Kingdom: Coventry Airport"
1128,11203,CWA,KCWA,"Mosinee, WI: Central Wisconsin"
1129,11207,CWI,KCWI,"Clinton, IA: Clinton Municipal"
1130,11208,CWL,EGFF,"Cardiff, United Kingdom: Cardiff Airport"
1131,11209,CWS,78WA,"Center Island, WA: Center Island Airport"
1132,11210,CWT,YCWR,"Cowra, Australia: Cowra Airport"
1133,11211,CXA,SVCD,"Caicara, Venezuela: Caicara Venez."
1134,11212,CXB,VGCB,"Cox's Bazar, Bangladesh: Cox's Bazar Airport"
1135,11213,CXC,KCXC,"Chitina, AK: Chitina Airport"
1136,11214,CXF,PACX,"Coldfoot, AK: Coldfoot Airport"
1137,11215,CXH,CYHC,"Vancouver, Canada: Coal Harbour Seaplane Base"
1138,11216,CXI,PLCH,"Christmas Island, Kiribati: Christmas Island Airport"
1139,11218,CXL,KCXL,"Calexico, CA: Calexico International"
1140,11219,CXO,KCXO,"Conroe, TX: Conroe North Houston Regional"
1141,11220,CXP,WIHL,"Cilacap, Indonesia: Tunggul Wulung"
1142,11222,CXT,YCHT,"Charters Towers, Australia: Charters Towers Airport"
1143,11223,CXY,MYCC,"Cat Cay, The Bahamas: Cat Cay Airport"
1144,11224,CYA,MTCA,"Les Cayes, Haiti: Cayes"
1145,11225,CYB,MWCB,"Cayman Brac, Cayman Islands: Charles Kirkconnell International"
1147,11227,CYF,PACK,"Chefornak, AK: Chefornak Airport"
1148,11229,CYI,RCKU,"Chiayi, Taiwan: Chiayi Airport"
1150,11231,CYP,RPVC,"Calbayog, Philippines: Calbayog Airport"
1151,11232,CYR,SUCA,"Colonia, Uruguay: Laguna de Los Patos International"
1152,11233,CYS,KCYS,"Cheyenne, WY: Cheyenne Regional/Jerry Olson Field"
1153,11234,CYT,0AA1,"Cape Yakataga, AK: Yakataga"
1154,11235,CYZ,RPUY,"Cauayan, Philippines: Cauayan Airport"
1155,11236,CZA,MMCT,"Chichen Itza, Mexico: Chichen Itza International"
1157,11238,CZC,KZ93,"Copper Center, AK: Copper Center 2"
1158,11240,CZE,SVCR,"Coro, Venezuela: Jose Leonardo Chirino"
1159,11241,CZF,PACZ,"Cape Romanzof, AK: Cape Romanzof LRRS"
1161,11243,CZL,DABC,"Constantine, Algeria: Constantine/Ain El Bey"
1162,11244,CZM,MMCZ,"Cozumel, Mexico: Cozumel International"
1163,11245,CZN,KCZN,"Chisana, AK: Chisana Airport"
1164,11246,CZO,KCZO,"Chistochina, AK: Chistochina Airport"
1166,11248,CZS,SBCZ,"Cruzeiro Do Sul, Brazil: Cruzeiro Do Sul Airport"
1167,11249,CZU,SKCZ,"Corozal, Colombia: Las Brujas"
1168,11250,CZW,EPRU,"Czestochowa, Poland: Czestochowy"
1169,11252,DAB,KDAB,"Daytona Beach, FL: Daytona Beach International"
1170,11253,DAC,VGHS,"Dhaka, Bangladesh: Hazrat Shahjalal International"
1171,11254,DAD,VVDN,"Danang, Vietnam: Danang International"
1172,11255,DAE,VEDZ,"Daet, Philippines: Daet Airport"
1174,11257,DAG,KDAG,"Daggett, CA: Barstow/Daggett"
1175,11258,DAK,HEDK,"Dakhla Oasis, Egypt: Dakhla"
1176,11259,DAL,KDAL,"Dallas, TX: Dallas Love Field"
1177,11260,DAM,OSDI,"Damascus, Syria: Damascus International"
1178,11261,DAN,KDAN,"Danville, VA: Danville Regional"
1179,11262,DAR,HTDA,"Dar Es Salaam, Tanzania: Julius Nyerere International"
1180,11263,DAT,ZBDT,"Datong, China: Datong Airport"
1181,11264,DAU,AYDU,"Daru, Papua New Guinea: Daru Airport"
1182,11265,DAV,MPDA,"David, Panama: Enrique Malek International"
1183,11266,DAX,ZUDX,"Daxian, China: Daxian Airport"
1184,11267,DAY,KDAY,"Dayton, OH: James M Cox/Dayton International"
1185,11269,DBB,HEAL,"Dabaa City, Egypt: Al Alamain International"
1186,11271,DBM,HADM,"Debra Marcos, Ethiopia: Debre Marcos"
1187,11272,DBN,KDBN,"Dublin, GA: W H Bud Barron"
1188,11273,DBO,YSDU,"Dubbo, Australia: Dubbo Airport"
1189,11274,DBQ,KDBQ,"Dubuque, IA: Dubuque Regional"
1190,11275,DBT,HADT,"Debra Tabor, Ethiopia: Debre Tabor"
1191,11276,DBV,LDDU,"Dubrovnik, Croatia: Dubrovnik Airport"
1192,11277,DBY,YDAY,"Dalby, Australia: Dalby Airport"
1193,11278,DCA,KDCA,"Washington, DC: Ronald Reagan Washington National"
1194,11279,DCF,TDCF,"Roseau, Dominica: Canefield"
1195,11280,DCK,PODC,"Dahl Creek, AK: Dahl Creek Airport"
1197,11282,DCU,KDCU,"Decatur, AL: Pryor Field Regional"
1198,11283,DDC,KDDC,"Dodge City, KS: Dodge City Regional"
1201,11287,DEB,LHDC,"Debrecen, Hungary: Debrecen Airport"
1202,11288,DEC,KDEC,"Decatur, IL: Decatur Airport"
1203,11289,DEH,KDEH,"Decorah, IA: Decorah Municipal"
1204,11290,DEL,VIDP,"Delhi, India: Indira Gandhi International"
1205,11291,DEM,HADD,"Dembi Dollo, Ethiopia: Dembi Dollo Airport"
1206,11292,DEN,KDEN,"Denver, CO: Denver International"
1207,11294,DES,FSDR,"Desroches, Seychelles: Desroches Airport"
1208,11295,DET,KDET,"Detroit, MI: Coleman A. Young Municipal"
1209,11296,DEZ,OSDZ,"Deir Ezzor, Syria: Al Jafrah/Deir Ezzor"
1210,11297,DFI,KDFI,"Defiance, OH: Defiance Memorial"
1211,11298,DFW,KDFW,"Dallas/Fort Worth, TX: Dallas/Fort Worth International"
1213,11301,DGO,MMDO,"Durango, Mexico: Durango International"
1214,11302,DGT,RPVD,"Dumaguete, Philippines: Dumaguete Airport"
1215,11303,DGW,KDGW,"Douglas, WY: Converse County"
1216,11304,DHA,OEDR,"Dhahran, Saudi Arabia: King Abdulaziz AB"
1217,11306,DHI,VNDH,"Dhangadhi, Nepal: Dhangadhi Airport"
1219,11308,DHN,KDHN,"Dothan, AL: Dothan Regional"
1220,11309,DHT,KDHT,"Dalhart, TX: Dalhart Municipal"
1221,11311,DIB,VEMN,"Dibrugarh, India: Dibrugarh Airport"
1222,11312,DIE,FMNA,"Antsiranana, Madagascar: Arrachart"
1223,11313,DIG,ZPDQ,"Shangri-La, China: Zhongdian"
1224,11314,DIJ,LFSD,"Dijon, France: Dijon Longvic"
1225,11315,DIK,KDIK,"Dickinson, ND: Dickinson - Theodore Roosevelt Regional"
1226,11316,DIL,WPDL,"Dili, Timor-Leste: Presidente Nicolau Lobato International"
1228,11318,DIR,HADR,"Dire Dawa, Ethiopia: Aba Tenna Dejazmatch Yilma"
1229,11319,DIS,FCPD,"Dolisie, Congo (Brazaville): Dolisie Airport"
1230,11320,DIU,VA1P,"Diu, India: Diu Airport"
1232,11322,DIY,LTCC,"Diyarbakir, Turkey: Diyarbakir Airport"
1233,11323,DJB,WIPA,"Jambi, Indonesia: Paalmerah"
1234,11324,DJE,DTTJ,"Djerba, Tunisia: Djerba Airport"
1235,11325,DJG,DAAJ,"Djanet, Algeria: Tiska"
1236,11326,DJJ,WAJJ,"Jayapura, Indonesia: Sentani"
1237,11327,DJN,KD66,"Delta Junction, AK: Delta Junction Airport"
1238,11328,DJO,DIDL,"Daloa, Cote d'Ivoire: Daloa Airport"
1240,11330,DKI,YDKI,"Dunk Island, Australia: Kyboola"
1241,11331,DKK,KDKK,"Dunkirk, NY: Chautauqua County/Dunkirk"
1242,11332,DKR,GOOY,"Dakar, Senegal: Leopold Sedar Senghor International"
1243,11333,DLA,FKKD,"Douala, Cameroon: Douala Airport"
1244,11334,DLC,ZYTL,"Dalian, China: Zhoushuizi"
1245,11335,DLF,KDLF,"Del Rio, TX: Laughlin AFB"
1246,11336,DLG,PADL,"Dillingham, AK: Dillingham Airport"
1247,11337,DLH,KDLH,"Duluth, MN: Duluth International"
1248,11338,DLI,VVDL,"Dalat, Vietnam: Lienkhang"
1249,11339,DLL,KDLC,"Dillon, SC: Dillon County"
1250,11340,DLM,LTBS,"Dalaman, Turkey: Dalaman Airport"
1252,11342,DLS,KDLS,"The Dalles, OR: Columbia Gorge Regional/The Dalles Municipal"
1253,11343,DLU,ZPDL,"Dali City, China: Xiaguan"
1254,11344,DMA,KDMA,"Tucson, AZ: Davis Monthan AFB"
1255,11345,DME,UUDD,"Moscow, Russia: Domodedovo"
1256,11348,DMN,KDMN,"Deming, NM: Deming Municipal"
1257,11349,DMO,KDMO,"Sedalia, MO: Sedalia Regional"
1258,11350,DMU,VEMR,"Dimapur, India: Manipur Road"
1259,11351,DNA,RODN,"Okinawa, Japan: Kadena AB"
1260,11352,DNB,YDBR,"Dunbar, Australia: Dunbar Airport"
1262,11354,DND,EGPN,"Dundee, United Kingdom: Dundee Airport"
1264,11358,DNL,KDNL,"Augusta, GA: Daniel Field"
1265,11359,DNN,KDNN,"Dalton, GA: Dalton Municipal"
1266,11360,DNO,SWDN,"Dianopolis, Brazil: Dianopolis Airport"
1267,11361,DNQ,YDLQ,"Deniliquin, Australia: Deniliquin Airport"
1268,11362,DNR,LFRD,"Dinard, France: Dinard Pleurtuit Saint Malo"
1269,11363,DNV,KDNV,"Danville, IL: Vermilion Regional"
1270,11365,DNZ,LTAY,"Denizli, Turkey: Cardak"
1271,11366,DOD,HTDO,"Dodoma, Tanzania: Dodoma Airport"
1273,11368,DOG,HSDN,"Dongola, Sudan: Dongola Airport"
1274,11370,DOK,UKCC,"Donetsk, Ukraine: Donetsk International"
1275,11371,DOL,LFRG,"Deauville, France: Deauville Normandie"
1276,11372,DOM,TDPD,"Marigot, Dominica: Douglas Charles"
1277,11373,DON,MGDL,"Dos Lagunas, Guatemala: Dos Lagunas Airport"
1278,11374,DOU,SSDO,"Dourados, Brazil: Dourados Airport"
1279,11375,DOV,KDOV,"Dover, DE: Dover AFB"
1280,11376,DPA,KDPA,"Chicago, IL: Du Page County"
1281,11377,DPG,KDPG,"Dugway, UT: Michael AAF"
1282,11378,DPL,RPMG,"Dipolog, Philippines: Dipolog Airport"
1283,11379,DPO,YDPO,"Devonport, Australia: Devonport Airport"
1305,11408,DRB,YDBY,"Derby, Australia: Derby Airport"
1306,11409,DRE,KDRM,"Drummond Island, MI: Drummond Island Airport"
1307,11410,DRF,3AK5,"Drift River, AK: Drift River Airport"
1308,11411,DRG,PADE,"Deering, AK: Deering Airport"
1309,11412,DRN,YDBI,"Dirranbandi, Australia: Dirranbandi Airport"
1310,11413,DRO,KDRO,"Durango, CO: Durango La Plata County"
1311,11414,DRS,EDDC,"Dresden, Germany: Dresden Airport"
1312,11415,DRT,KDRT,"Del Rio, TX: Del Rio International"
1313,11416,DRU,KM26,"Drummond, MT: Drummond Airport"
1314,11417,DRW,YPDN,"Darwin, Australia: Darwin International"
1315,11418,DSA,EGCN,"Finningley, United Kingdom: Doncaster Sheffield"
1316,11419,DSD,TFFA,"La Desirade, Guadeloupe: La Desirade Airport"
1317,11420,DSE,HADC,"Dessie, Ethiopia: Dessie/Combolcha"
1318,11421,DSI,KDTS,"Destin, FL: Destin Executive"
1319,11422,DSK,OPDI,"Dera Ismail Khan, Pakistan: D. I. Khan"
1320,11423,DSM,KDSM,"Des Moines, IA: Des Moines International"
1321,11424,DTA,KDTA,"Delta, UT: Delta Municipal"
1322,11425,DTH,KL06,"Death Valley, CA: Furnace Creek"
1323,11427,DTL,KDTL,"Detroit Lakes, MN: Detroit Lakes-Wething Field"
1324,11428,DTM,EDLW,"Dortmund, Germany: Dortmund Airport"
1325,11429,DTN,KDTN,"Shreveport, LA: Shreveport Downtown"
1327,11431,DTR,WN07,"Decatur Island, WA: Decatur"
1329,11433,DTW,KDTW,"Detroit, MI: Detroit Metro Wayne County"
1330,11434,DUA,KDUA,"Durant, OK: Eaker Field"
1331,11435,DUB,EIDW,"Dublin, Ireland: Dublin Airport"
1332,11436,DUC,KDUC,"Duncan, OK: Halliburton Field"
1333,11437,DUD,NZDN,"Dunedin, New Zealand: Dunedin Airport"
1334,11439,DUF,7NC2,"Duck, NC: Pine Island"
1335,11440,DUG,KDUG,"Douglas, AZ: Bisbee Douglas International"
1336,11441,DUJ,KDUJ,"DuBois, PA: DuBois Regional"
1337,11442,DUQ,CAM3,"Duncan/Quamichan Lake, Canada: Duncan"
1338,11444,DUS,EDDL,"Dusseldorf, Germany: Duesseldorf"
1339,11445,DUT,PADU,"Unalaska, AK: Unalaska Airport"
1340,11446,DVK,CDK2,"Diavik, Canada: Diavik Airport"
1341,11447,DVL,KDVL,"Devils Lake, ND: Devils Lake Regional"
1342,11448,DVN,KDVN,"Davenport, IA: Davenport Municipal"
1343,11449,DVO,RPMD,"Davao, Philippines: Francisco Bangoy International"
1344,11450,DVT,KDVT,"Phoenix, AZ: Phoenix - Deer Valley"
1345,11452,DWA,FWDW,"Davis/Woodland/Winters, CA: Yolo County"
1346,11453,DWH,KDWH,"Houston, TX: David Wayne Hooks Memorial"
1348,11455,DXB,OMDB,"Dubai, United Arab Emirates: Dubai International"
1349,11456,DXR,KDXR,"Danbury, CT: Danbury Municipal"
1350,11457,DYG,ZGDY,"Dayong, China: Hehua"
1351,11458,DYR,UHMA,"Anadyr, Russia: Ugolny"
1352,11459,DYS,KDYS,"Abilene, TX: Dyess AFB"
1353,11460,DYU,UTDD,"Dushanbe, Tajikistan: Dushanbe Airport"
1354,11461,DZA,FMCZ,"Dzaoudzi, Mayotte: Dzaoudzi-Pamandzi"
1355,11462,DZO,SUDU,"Durazno, Uruguay: Durazno Airport"
1356,11463,EAA,PAEG,"Eagle, AK: Eagle Airport"
1358,11466,EAM,OENG,"Nejran, Saudi Arabia: Nejran Airport"
1359,11467,EAN,KEAN,"Wheatland, WY: Phifer Airfield"
1360,11468,EAR,KEAR,"Kearney, NE: Kearney Regional"
1361,11469,EAS,LESO,"San Sebastian, Spain: San Sebastian Airport"
1362,11470,EAT,KEAT,"Wenatchee, WA: Pangborn Memorial"
1363,11471,EAU,KEAU,"Eau Claire, WI: Chippewa Valley Regional"
1364,11472,EBA,LIRJ,"Elba Island, Italy: Marina Di Campo"
1365,11473,EBB,HUEN,"Entebbe/Kampala, Uganda: Entebbe International"
1366,11474,EBD,HSOB,"El Obeid, Sudan: El Obeid Airport"
1367,11475,EBJ,EKEB,"Esbjerg, Denmark: Esbjerg Airport"
1368,11476,EBL,ORER,"Erbil, Iraq: Erbil International"
1369,11477,EBU,LFMH,"St. Etienne, France: Saint Etienne Loire"
1370,11478,ECA,K6D9,"East Tawas, MI: Iosco County"
1371,11479,ECG,KECG,"Elizabeth City, NC: Elizabeth City CGAS/Regional"
1372,11480,ECN,LCEN,"Ercan, Cyprus: Ercan Airport"
1373,11481,ECP,KECP,"Panama City, FL: Northwest Florida Beaches International"
1374,11482,ECS,KECS,"Newcastle, WY: Mondell Field"
1377,11486,EDE,KEDE,"Edenton, NC: Northeastern Regional"
1378,11487,EDF,PAED,"Anchorage, AK: Elmendorf AFB"
1379,11488,EDI,EGPH,"Edinburgh, United Kingdom: Edinburgh Airport"
1380,11489,EDL,HKEL,"Eldoret, Kenya: Eldoret Airport"
1381,11490,EDW,KEDW,"Edwards, CA: Edwards AFB"
1382,11491,EED,KEED,"Needles, CA: Needles Airport"
1383,11492,EEK,PAEE,"Eek, AK: Eek Airport"
1384,11493,EEN,KEEN,"Keene, NH: Dillant Hopkins"
1386,11495,EFD,KEFD,"Houston, TX: Ellington"
1387,11496,EFK,KEFK,"Newport, VT: Northeast Kingdom International"
1388,11497,EFL,LGKF,"Kefallinia Island, Greece: Argostolion"
1392,11502,EGC,LFBE,"Bergerac, France: Bergerac Dordogne Perigord"
1393,11503,EGE,KEGE,"Eagle, CO: Eagle County Regional"
1394,11504,EGI,KEGI,"Crestview, FL: Duke Field"
1395,11505,EGN,HSGN,"Geneina, Sudan: Geneina Airport"
1396,11506,EGP,K5T9,"Eagle Pass, TX: Eagle Pass Municipal"
1397,11507,EGS,BIEG,"Egilsstadir, Iceland: Egilsstadir Airport"
1399,11510,EGV,KEGV,"Eagle River, WI: Eagle River Union"
1400,11511,EGX,PAII,"Egegik, AK: Egegik Airport"
1401,11512,EHM,PAEH,"Cape Newenham, AK: Cape Newenham LRRS"
1405,11516,EIB,EDGE,"Eisenach, Germany: Eisenach Kindel"
1406,11517,EIL,PAEI,"Fairbanks, AK: Eielson AFB"
1407,11518,EIN,EHEH,"Eindhoven, Netherlands: Eindhoven Airport"
1408,11519,EIS,TUPJ,"Road Town, British Virgin Islands: Terrance B Lettsome"
1409,11520,EJA,SKEJ,"Barrancabermeja, Colombia: Yariguies"
1410,11521,EJH,OEWJ,"Wedjh, Saudi Arabia: Wedjh Airport"
1411,11522,EKA,KEKA,"Eureka, CA: Murray Field"
1412,11523,EKI,KEKM,"Elkhart, IN: Elkhart Municipal"
1413,11525,EKO,KEKO,"Elko, NV: Elko Regional"
1414,11526,EKX,KEKX,"Elizabethtown, KY: Addington Field"
1416,11528,ELA,KELA,"Eagle Lake, TX: Eagle Lake Airport"
1417,11529,ELB,SKBC,"El Banco, Colombia: El Banco Airport"
1418,11530,ELC,YELD,"Elcho Island, Australia: Elcho Island Airport"
1419,11531,ELD,KELD,"El Dorado, AR: South Arkansas Regional at Goodwin Field"
1420,11532,ELF,HSFS,"El Fasher, Sudan: El Fasher Airport"
1421,11533,ELG,DAUE,"El Golea, Algeria: El Golea Airport"
1422,11534,ELH,MYEH,"North Eleuthera, The Bahamas: North Eleuthera Airport"
1423,11535,ELI,PFEL,"Elim, AK: Elim Airport"
1425,11537,ELM,KELM,"Elmira/Corning, NY: Elmira/Corning Regional"
1426,11538,ELN,KELN,"Ellensburg, WA: Bowers Field"
1427,11540,ELP,KELP,"El Paso, TX: El Paso International"
1428,11541,ELQ,OEGS,"Gassim, Saudi Arabia: Prince Naif Bin Abdulaziz"
1429,11544,ELT,HETR,"El Tor, Egypt: El Tor Airport"
1432,11547,ELY,KELY,"Ely, NV: Ely Airport/Yelland Field"
1433,11548,EMA,EGNX,"Derby, United Kingdom: East Midlands"
1434,11549,EMD,YEML,"Emerald, Australia: Emerald Airport"
1435,11550,EMK,PAEM,"Emmonak, AK: Emmonak Airport"
1436,11551,EMM,KEMM,"Kemmerer, WY: Kemmerer Municipal"
1437,11552,EMN,GQNI,"Nema, Mauritania: Nema Airport"
1438,11553,EMP,KEMP,"Emporia, KS: Emporia Municipal"
1439,11554,EMT,KEMT,"El Monte, CA: San Gabriel Valley"
1440,11555,ENA,PAEN,"Kenai, AK: Kenai Municipal"
1441,11556,ENC,LFSN,"Nancy, France: Nancy Essey"
1442,11557,END,KEND,"Enid, OK: Vance AFB"
1443,11558,ENL,KENL,"Centralia, IL: Centralia Municipal"
1444,11559,ENN,PANN,"Nenana, AK: Nenana Municipal"
1445,11561,ENS,EHTW,"Enschede, Netherlands: Twente"
1446,11562,ENU,DNEN,"Enugu, Nigeria: Akanu Ibiam International"
1447,11563,ENV,KENV,"Wendover, UT: Wendover Airport"
1448,11564,ENW,KENW,"Kenosha, WI: Kenosha Regional"
1449,11565,EOH,SKMD,"Medellin, Colombia: Olaya Herrera"
1450,11566,EOK,KEOK,"Keokuk, IA: Keokuk Municipal"
1451,11567,EPH,KEPH,"Ephrata/Moses Lake, WA: Ephrata Municipal"
1452,11569,EPL,LFSG,"Epinal, France: Epinal Mirecourt"
1454,11571,EPR,YESP,"Esperance, Australia: Esperance Airport"
1455,11572,EQS,SAVE,"Esquel, Argentina: Esquel Airport"
1456,11573,ERA,HCMU,"Erigavo, Somalia: Erigavo Airport"
1457,11574,ERC,LTCD,"Erzincan, Turkey: Erzincan Airport"
1458,11575,ERD,UKDB,"Berdyansk, Ukraine: Berdyansk Airport"
1459,11576,ERF,EDDE,"Erfurt, Germany: Erfurt Weimar"
1460,11577,ERI,KERI,"Erie, PA: Erie International/Tom Ridge Field"
1461,11578,ERM,SSER,"Erechim, Brazil: Erechim Airport"
1462,11579,ERN,SWEI,"Eirunepe, Brazil: Eirunepe Airport"
1463,11580,ERS,FYWE,"Windhoek, Namibia: Eros"
1465,11582,ERV,KERV,"Kerrville, TX: Kerrville Municipal/Louis Schreiner Field"
1466,11583,ERZ,LTCE,"Erzurum, Turkey: Erzurum Airport"
1469,11586,ESB,LTAC,"Ankara, Turkey: Esenboga"
1470,11587,ESC,KESC,"Escanaba, MI: Delta County"
1471,11588,ESD,KORS,"Eastsound, WA: Orcas Island"
1472,11590,ESF,KESF,"Alexandria, LA: Esler Regional"
1473,11591,ESM,SETN,"Esmeraldas, Ecuador: Coronel Carlos Concha Torres"
1474,11592,ESN,KESN,"Easton, MD: Easton/Newnam Field"
1476,11594,ESR,SCES,"El Salvador, Chile: Ricardo Garcia Posada"
1477,11595,ESS,EDLE,"Essen, Germany: Essen Muelheim"
1478,11596,ETH,LLET,"Eilat, Israel: Eilat Airport"
1479,11597,ETN,KETN,"Eastland, TX: Eastland Municipal"
1480,11598,ETS,KEDN,"Enterprise, AL: Enterprise Municipal"
1481,11599,ETZ,LFJL,"Metz/Nancy, France: Metz Nancy Lorraine"
1482,11600,EUA,NFTE,"Eua, Tonga: Eua Airport"
1483,11601,EUE,K05U,"Eureka, NV: Eureka Airport"
1484,11602,EUF,KEUF,"Eufaula, AL: Weedon Field"
1485,11603,EUG,KEUG,"Eugene, OR: Mahlon Sweet Field"
1486,11604,EUN,GMML,"Laayoune, Morocco: Hassan I International"
1487,11605,EUX,TNCE,"St. Eustatius, Bonaire, Sint Eustatius, and Saba: F.D. Roosevelt"
1489,11608,EVG,ESND,"Sveg, Sweden: Sveg Airport"
1490,11609,EVM,KEVM,"Eveleth, MN: Eveleth Virginia Municipal"
1491,11610,EVN,UDYZ,"Yerevan, Armenia: Zvartnots"
1492,11612,EVV,KEVV,"Evansville, IN: Evansville Regional"
1493,11613,EVW,KEVW,"Evanston, WY: Evanston-Uinta County Burns Field"
1494,11614,EVX,LFOE,"Evreux, France: Evreux Fauville"
1495,11615,EWB,KEWB,"New Bedford/Fall River, MA: New Bedford Regional"
1496,11616,EWK,KEWK,"Newton, KS: Newton City County"
1497,11617,EWN,KEWN,"New Bern/Morehead/Beaufort, NC: Coastal Carolina Regional"
1498,11618,EWR,KEWR,"Newark, NJ: Newark Liberty International"
1500,11620,EXT,EGTE,"Exeter, United Kingdom: Exeter Airport"
1502,11622,EYL,GAYE,"Yelimane, Mali: Yelimane Airport"
1503,11623,EYP,SKYP,"El Yopal, Colombia: El Yopal Airport"
1504,11624,EYW,KEYW,"Key West, FL: Key West International"
1505,11625,EZE,SAEZ,"Ezeiza, Argentina: Ministro Pistarini"
1506,11626,EZS,LTCA,"Elazig, Turkey: Elazig Airport"
1508,11628,FAB,EGLF,"Farnborough, United Kingdom: Farnborough Airport"
1509,11629,FAE,EKVG,"Sorvagur, Denmark: Vagar"
1510,11630,FAI,PAFA,"Fairbanks, AK: Fairbanks International"
1514,11634,FAM,KFAM,"Farmington, MO: Farmington Regional"
1516,11636,FAO,LPFR,"Faro, Portugal: Faro Airport"
1517,11637,FAR,KFAR,"Fargo, ND: Hector International"
1518,11638,FAT,KFAT,"Fresno, CA: Fresno Yosemite International"
1519,11639,FAU,OOFD,"Fairmount Island, AK: Fairmount Island Airport"
1520,11640,FAV,NTGF,"Fakarava, French Polynesia: Fakarava Airport"
1521,11641,FAY,KFAY,"Fayetteville, NC: Fayetteville Regional/Grannis Field"
1522,11642,FBG,KFBG,"Fort Bragg, NC: Simmons AAF"
1523,11643,FBK,PAFB,"Fairbanks, AK: Ladd AAF"
1524,11644,FBM,FZQA,"Lubumbashi, Congo (Kinshasa): Lubumbashi International"
1525,11645,FBR,KFBR,"Fort Bridger, WY: Fort Bridger Airport"
1528,11648,FCA,KGPI,"Kalispell, MT: Glacier Park International"
1529,11649,FCH,KFCH,"Fresno, CA: Fresno Chandler Executive"
1530,11650,FCM,KFCM,"Minneapolis, MN: Flying Cloud"
1531,11651,FCO,LIRF,"Rome, Italy: Fiumicino"
1532,11653,FDE,ENBL,"Forde, Norway: Forde Airport"
1533,11654,FDF,TFFF,"Fort de France, Martinique: Martinique Aime Cesaire"
1534,11655,FDH,EDNY,"Friedrichshafen, Germany: Friedrichshafen Airport"
1535,11656,FDK,KFDK,"Frederick, MD: Frederick Municipal"
1536,11657,FDR,KFDR,"Frederick, OK: Frederick Regional"
1537,11658,FDU,FZBO,"Bandundu, Congo (Kinshasa): Bandundu Airport"
1538,11659,FDY,KFDY,"Findlay, OH: Findlay Airport"
1539,11660,FEG,UTFF,"Fergana, Uzbekistan: Fergana Airport"
1540,11661,FEN,SBFN,"Fernando de Noronha, Brazil: Fernando de Noronha Airport"
1541,11662,FEP,KFEP,"Freeport, IL: Albertus"
1542,11663,FET,KFET,"Fremont, NE: Fremont Municipal"
1544,11665,FEZ,GMFF,"Fez, Morocco: Saiss International"
1545,11666,FFD,EGVA,"Fairford, United Kingdom: RAF Fairford"
1546,11667,FFM,KFFM,"Fergus Falls, MN: Fergus Falls Municipal-Einar Mickelson Field"
1547,11668,FFO,KFFO,"Dayton, OH: Wright-Patterson AFB"
1548,11669,FFT,KFFT,"Frankfort, KY: Capital City"
1549,11670,FGD,GQPF,"Fderik, Mauritania: Fderik Airport"
1550,11671,FGI,NSFI,"Apia, Samoa: Fagali I"
1551,11673,FHU,KFHU,"Fort Huachuca, AZ: Sierra Vista Municipal-Libby AAF"
1553,11675,FID,K0B8,"Fishers Island, NY: Elizabeth Field"
1554,11676,FIH,FZAA,"Kinshasa, Congo (Kinshasa): N'Djili International"
1555,11677,FIL,KFOM,"Fillmore, UT: Fillmore Municipal"
1556,11678,FIN,AYFI,"Finschhafen, Papua New Guinea: Finschhafen Airport"
1557,11679,FIZ,YFTZ,"Fitzroy Crossing, Australia: Fitzroy Crossing Airport"
1558,11680,FJR,OMFJ,"Al-Fujairah, United Arab Emirates: Fujairah International"
1559,11681,FKB,EDSB,"Karlsruhe/Baden-Baden, Germany: Karlsruhe/Baden-Baden Airport"
1560,11682,FKI,FZIC,"Kisangani, Congo (Kinshasa): Bangoka International"
1561,11683,FKJ,RJNF,"Fukui, Japan: Fukui Airport"
1562,11684,FKL,KFKL,"Franklin/Oil City, PA: Venango Regional"
1563,11685,FKS,RJSF,"Fukushima, Japan: Fukushima Airport"
1569,11691,FLA,SKFL,"Florencia, Colombia: Gustavo Artunduaga Paredes"
1570,11692,FLB,SNQG,"Floriano, Brazil: Floriano Airport"
1571,11693,FLD,KFLD,"Fond Du Lac, WI: Fond Du Lac County"
1572,11694,FLF,EDXF,"Flensburg, Germany: Flensburg Schaeferhaus"
1573,11695,FLG,KFLG,"Flagstaff, AZ: Flagstaff Pulliam"
1575,11697,FLL,KFLL,"Fort Lauderdale, FL: Fort Lauderdale-Hollywood International"
1576,11698,FLN,SBFL,"Florianopolis, Brazil: Hercilio Luz International"
1577,11699,FLO,KFLO,"Florence, SC: Florence Regional"
1578,11700,FLR,LIRQ,"Florence, Italy: Firenze"
1579,11701,FLS,YFLI,"Flinders Island, Australia: Flinders Island Airport"
1580,11702,FLT,KFLT,"Flat, AK: Flat Airport"
1582,11704,FLV,KFLV,"Leavenworth, KS: Sherman AAF"
1583,11705,FLW,LPFL,"Santa Cruz das Flores, Portugal: Flores"
1584,11706,FLX,KFLX,"Fallon, NV: Fallon Municipal"
1585,11707,FMA,SARF,"Formosa, Argentina: Formosa Airport"
1587,11709,FMH,KFMH,"Falmouth, MA: Cape Cod CGAS"
1588,11710,FMI,FZRF,"Kalemie, Congo (Kinshasa): Kalemie Airport"
1589,11711,FMN,KFMN,"Farmington, NM: Four Corners Regional"
1590,11712,FMO,EDDG,"Greven, Germany: Muenster Osnabrueck"
1591,11713,FMS,KFSW,"Fort Madison, IA: Fort Madison Municipal"
1592,11714,FMY,KFMY,"Fort Myers, FL: Page Field"
1593,11716,FNC,LPMA,"Funchal, Portugal: Madeira"
1594,11717,FNI,LFTW,"Nimes, France: Nimes Garons"
1595,11718,FNJ,ZKPY,"Pyongyang, North Korea: Pyongyang International"
1596,11719,FNL,KFNL,"Fort Collins/Loveland, CO: Northern Colorado Regional"
1598,11721,FNT,KFNT,"Flint, MI: Bishop International"
1599,11723,FOB,82CL,"Fort Bragg, CA: Fort Bragg Airport"
1600,11724,FOC,ZSFZ,"Fuzhou, China: Changle"
1601,11725,FOD,KFOD,"Fort Dodge, IA: Fort Dodge Regional"
1602,11726,FOE,KFOE,"Topeka, KS: Topeka Regional"
1603,11727,FOG,LIBF,"Foggia, Italy: Foggia Airport"
1604,11728,FOK,KFOK,"Westhampton, NY: Francis S. Gabreski"
1605,11730,FOR,SBFZ,"Fortaleza, Brazil: Pinto Martins International"
1606,11731,FPO,MYGF,"Freeport, The Bahamas: Grand Bahama International"
1607,11732,FPR,KFPR,"Fort Pierce, FL: Treasure Coast International"
1608,11733,FPY,KFPY,"Perry, FL: Perry-Foley"
1631,11760,FRA,EDDF,"Frankfurt, Germany: Frankfurt Main"
1632,11761,FRC,SIMK,"Franca, Brazil: Tenente Lund Pressoto"
1633,11762,FRD,KFHR,"Friday Harbor, WA: Friday Harbor Airport"
1635,11764,FRG,KFRG,"East Farmingdale, NY: Republic"
1636,11765,FRL,LIPK,"Forli, Italy: Forli Airport"
1637,11766,FRM,KFRM,"Fairmont, MN: Fairmont Municipal"
1638,11767,FRO,ENFL,"Floro, Norway: Floro Airport"
1640,11769,FRR,KFRR,"Front Royal, VA: Front Royal-Warren County"
1641,11770,FRS,MGTK,"Flores, Guatemala: Flores Airport"
1642,11771,FRU,UCFM,"Bishkek, Kyrgyzstan: Manas"
1643,11773,FRY,KIZG,"Fryeburg, ME: Eastern Slopes Regional"
1644,11774,FSC,LFKF,"Figari, France: Figari Sud Corse"
1645,11775,FSD,KFSD,"Sioux Falls, SD: Joe Foss Field"
1646,11776,FSI,KFSI,"Fort Sill, OK: Henry Post AAF"
1647,11777,FSK,KFSK,"Fort Scott, KS: Fort Scott Municipal"
1648,11778,FSM,KFSM,"Fort Smith, AR: Fort Smith Regional"
1649,11779,FSP,LFVP,"St. Pierre, Saint Pierre and Miquelon: Saint Pierre"
1650,11780,FST,KFST,"Ft. Stockton, TX: Fort Stockton Pecos County"
1651,11781,FSZ,RJNS,"Shizuoka, Japan: Shizuoka Airport"
1653,11783,FTE,SAWC,"El Calafate, Argentina: El Calafate Airport"
1654,11785,FTK,KFTK,"Fort Knox, KY: Godman AAF"
1656,11787,FTU,FMSD,"Fort Dauphin, Madagascar: Marillac"
1657,11788,MVZ,FVMV,"Masvingo, Zimbabwe: Masvingo International"
1658,11789,FTW,KFTW,"Dallas/Fort Worth, TX: Fort Worth Meacham International"
1659,11791,FUE,GCFV,"Fuerteventura, Spain: Fuerteventura Airport"
1660,11792,FUJ,RJFE,"Fukue, Japan: Fukue Airport"
1661,11793,FUK,RJFF,"Fukuoka, Japan: Fukuoka Airport"
1662,11794,FUL,KFUL,"Fullerton, CA: Fullerton Municipal"
1663,11795,FUN,NGFU,"Funafuti, Tuvalu: Funafuti International"
1664,11796,FUT,NLWF,"Futuna Island, Wallis and Futuna: Futuna Pointe Vele"
1690,11823,FWA,KFWA,"Fort Wayne, IN: Fort Wayne International"
1691,11824,FWH,KNFW,"Fort Worth, TX: Fort Worth NAS JRB/Carswell Field"
1692,11825,FWL,0AA4,"Farewell, AK: Farewell Airport"
1694,11827,FXE,KFXE,"Fort Lauderdale, FL: Fort Lauderdale Executive"
1696,11829,FXO,FQCB,"Nova Freixo, Mozambique: Nova Freixo Airport"
1697,11831,FXY,KFXY,"Forest City, IA: Forest City Municipal"
1698,11832,FYT,FTTY,"Faya-Largeau, Chad: Faya-Largeau Airport"
1699,11833,FYU,PFYU,"Fort Yukon, AK: Fort Yukon Airport"
1700,11834,FYV,KFYV,"Fayetteville, AR: Drake Field"
1701,11835,FZO,EGTG,"Filton, United Kingdom: Bristol Filton"
